id,createdAt,content,authorId
836,5/3/2022,massa volutpat convallis morbi odio odio elementum eu interdum eu tincidunt in leo maecenas pulvinar lobortis est,21
837,12/24/2022,a odio in hac habitasse platea dictumst maecenas ut massa,102
838,3/7/2022,laoreet ut rhoncus aliquet pulvinar sed nisl nunc rhoncus dui vel,110
839,12/17/2022,at nunc commodo placerat praesent blandit nam nulla integer pede justo lacinia eget tincidunt eget tempus vel pede morbi porttitor,149
840,12/19/2022,platea dictumst morbi vestibulum velit id pretium iaculis diam erat fermentum justo nec condimentum neque sapien placerat ante nulla,19
841,4/9/2022,maecenas ut massa quis augue luctus,146
842,9/1/2022,cubilia curae duis faucibus accumsan,153
843,1/17/2023,sit amet consectetuer adipiscing elit proin interdum mauris non ligula pellentesque ultrices phasellus id sapien,29
844,10/29/2022,nullam sit amet turpis elementum ligula vehicula consequat morbi a ipsum integer a nibh in quis justo maecenas rhoncus aliquam,17
845,10/24/2022,vel nulla eget eros elementum pellentesque quisque porta volutpat erat quisque erat eros viverra,31
846,10/1/2022,justo etiam pretium iaculis justo in hac habitasse platea,93
847,7/16/2022,tellus nulla ut erat id mauris vulputate elementum nullam varius nulla facilisi,199
848,10/24/2022,vitae mattis nibh ligula nec sem duis aliquam convallis nunc proin at turpis,129
849,9/16/2022,ipsum dolor sit amet consectetuer adipiscing elit proin interdum mauris non ligula pellentesque ultrices phasellus id sapien in,156
850,7/7/2022,at velit vivamus vel nulla eget eros elementum pellentesque quisque porta volutpat,104
851,4/8/2022,ante nulla justo aliquam,69
852,2/23/2022,semper est quam pharetra magna,178
853,8/15/2022,varius ut blandit non interdum in ante vestibulum ante ipsum primis in faucibus,182
854,7/14/2022,bibendum felis sed interdum venenatis turpis enim blandit mi in porttitor pede justo eu massa donec dapibus,101
855,10/31/2022,fusce lacus purus aliquet at feugiat non pretium quis lectus suspendisse potenti in eleifend quam,60
856,2/9/2022,leo odio condimentum id luctus nec molestie,67
857,5/13/2022,amet erat nulla tempus,89
858,1/3/2023,cubilia curae donec pharetra magna vestibulum aliquet ultrices erat,105
859,1/24/2023,quam fringilla rhoncus mauris enim leo rhoncus sed vestibulum sit amet cursus,190
860,2/25/2022,justo in blandit ultrices enim lorem,42
861,7/6/2022,lacinia aenean sit amet justo,176
862,4/20/2022,augue vel accumsan tellus nisi eu orci mauris lacinia sapien quis libero nullam sit amet turpis,138
863,12/5/2022,quam sollicitudin vitae consectetuer eget rutrum at lorem integer tincidunt ante vel,55
864,5/13/2022,eget rutrum at lorem integer tincidunt ante vel ipsum praesent blandit lacinia erat vestibulum sed magna,10
865,9/11/2022,interdum mauris ullamcorper purus sit amet nulla quisque arcu libero rutrum,6
866,5/21/2022,quis odio consequat varius integer ac leo pellentesque ultrices mattis odio donec vitae nisi nam ultrices libero non mattis,166
867,2/3/2022,tortor id nulla ultrices aliquet maecenas leo odio condimentum,113
868,9/18/2022,integer tincidunt ante vel ipsum praesent blandit lacinia erat vestibulum sed magna at nunc commodo placerat praesent blandit nam,5
869,12/5/2022,eu tincidunt in leo maecenas pulvinar lobortis est phasellus sit,126
870,10/27/2022,luctus et ultrices posuere cubilia curae duis faucibus,148
871,4/16/2022,phasellus in felis donec semper sapien,171
872,7/8/2022,magna vulputate luctus cum sociis natoque penatibus et magnis dis parturient montes nascetur ridiculus mus vivamus vestibulum sagittis,133
873,11/15/2022,nulla sed accumsan felis ut at dolor quis odio consequat,77
874,7/10/2022,mattis pulvinar nulla pede ullamcorper augue a suscipit nulla elit ac nulla sed vel enim sit amet nunc,93
875,5/29/2022,sapien in sapien iaculis,26
876,11/27/2022,lorem ipsum dolor sit amet consectetuer adipiscing elit proin risus praesent lectus vestibulum quam,145
877,11/15/2022,in lacus curabitur at ipsum ac tellus,180
878,5/13/2022,semper est quam pharetra magna ac consequat metus sapien ut nunc vestibulum ante,45
879,12/29/2022,sollicitudin vitae consectetuer eget rutrum,51
880,5/16/2022,montes nascetur ridiculus mus vivamus vestibulum sagittis sapien cum,35
881,6/29/2022,malesuada in imperdiet et commodo vulputate justo in blandit ultrices enim lorem ipsum dolor sit amet consectetuer adipiscing elit proin,149
882,5/5/2022,non interdum in ante vestibulum ante ipsum primis in faucibus orci luctus et ultrices posuere cubilia curae duis faucibus accumsan,119
883,2/13/2022,nulla elit ac nulla sed vel enim sit amet nunc viverra dapibus nulla suscipit ligula in lacus curabitur at,165
884,9/27/2022,nulla justo aliquam quis turpis eget,107
885,8/2/2022,nunc proin at turpis a pede posuere,91
886,12/26/2022,in felis donec semper sapien a libero nam dui proin leo odio porttitor id consequat in consequat ut,65
887,6/20/2022,tempus sit amet sem fusce consequat nulla nisl nunc nisl duis bibendum felis sed interdum venenatis turpis enim blandit,42
888,1/27/2022,quam sollicitudin vitae consectetuer eget rutrum at lorem integer tincidunt ante vel ipsum praesent blandit lacinia erat,127
889,11/29/2022,tincidunt eget tempus vel pede morbi,88
890,7/31/2022,pellentesque viverra pede ac diam cras pellentesque volutpat dui maecenas tristique est et tempus semper,38
891,2/27/2022,lacus morbi quis tortor id nulla ultrices aliquet,5
892,8/23/2022,sit amet diam in magna bibendum imperdiet nullam orci pede venenatis non sodales sed tincidunt eu felis fusce posuere felis,176
893,11/11/2022,diam id ornare imperdiet sapien urna pretium nisl ut volutpat sapien arcu,124
894,7/21/2022,non mattis pulvinar nulla pede ullamcorper,40
895,12/19/2022,dapibus dolor vel est,45
896,9/7/2022,ultrices enim lorem ipsum dolor sit amet consectetuer adipiscing elit proin interdum,111
897,3/18/2022,dictumst etiam faucibus cursus urna ut tellus nulla ut erat id mauris vulputate elementum nullam varius nulla facilisi cras non,137
898,12/11/2022,eu est congue elementum in hac habitasse platea dictumst morbi vestibulum velit id pretium iaculis diam erat fermentum justo,23
899,3/15/2022,et ultrices posuere cubilia curae,192
900,3/17/2022,convallis duis consequat dui nec nisi volutpat eleifend donec ut dolor morbi vel lectus in quam fringilla rhoncus,46
901,1/4/2023,augue a suscipit nulla elit,107
902,1/31/2022,mattis egestas metus aenean fermentum donec,30
903,10/14/2022,volutpat eleifend donec ut dolor morbi vel lectus,65
904,12/14/2022,vitae mattis nibh ligula nec sem duis aliquam,88
905,6/28/2022,sed augue aliquam erat volutpat in congue etiam justo etiam pretium iaculis justo in hac habitasse,12
906,6/13/2022,convallis tortor risus dapibus augue vel accumsan tellus,191
907,5/26/2022,at turpis a pede posuere,140
908,4/17/2022,purus sit amet nulla quisque,118
909,4/22/2022,magna at nunc commodo placerat praesent blandit nam nulla integer pede justo lacinia,17
910,3/23/2022,egestas metus aenean fermentum donec ut mauris eget massa tempor convallis nulla neque libero convallis eget eleifend luctus,108
911,8/31/2022,nullam orci pede venenatis,65
912,6/26/2022,nulla elit ac nulla sed vel enim sit amet nunc viverra dapibus nulla suscipit ligula in,30
913,10/14/2022,tortor sollicitudin mi sit amet lobortis sapien sapien non mi integer ac neque duis bibendum morbi non,16
914,5/12/2022,tempus semper est quam pharetra magna ac consequat metus sapien ut nunc vestibulum ante ipsum primis in,45
915,12/26/2022,eget nunc donec quis orci eget orci vehicula condimentum curabitur in,181
916,12/3/2022,a pede posuere nonummy integer non velit donec diam neque vestibulum eget vulputate,75
917,5/25/2022,sed interdum venenatis turpis,121
918,8/28/2022,suspendisse potenti cras in purus,73
919,10/28/2022,platea dictumst aliquam augue quam sollicitudin vitae consectetuer eget rutrum at lorem integer tincidunt ante vel ipsum praesent blandit lacinia,90
920,2/10/2022,cum sociis natoque penatibus et,122
921,10/21/2022,tortor duis mattis egestas metus aenean fermentum donec ut mauris eget massa tempor convallis nulla neque libero convallis eget,127
922,3/3/2022,est phasellus sit amet erat nulla tempus vivamus in felis eu sapien cursus vestibulum proin eu mi nulla ac enim,146
923,11/23/2022,urna ut tellus nulla ut erat id mauris vulputate elementum nullam varius nulla facilisi cras non velit nec nisi,113
924,4/12/2022,id mauris vulputate elementum nullam varius nulla facilisi cras non velit,9
925,9/5/2022,convallis nunc proin at turpis a pede posuere nonummy integer,88
926,7/15/2022,in leo maecenas pulvinar lobortis est phasellus,69
927,4/15/2022,fusce lacus purus aliquet at feugiat non pretium quis lectus suspendisse potenti in eleifend quam a odio in,72
928,4/2/2022,elementum eu interdum eu tincidunt in leo maecenas pulvinar lobortis est phasellus sit amet erat nulla,151
929,1/20/2023,sapien arcu sed augue aliquam erat volutpat in congue etiam,94
930,11/28/2022,lorem ipsum dolor sit amet consectetuer adipiscing elit proin risus praesent lectus vestibulum quam sapien varius ut blandit non interdum,135
931,3/14/2022,accumsan tortor quis turpis sed ante vivamus tortor duis mattis egestas metus aenean fermentum donec ut mauris eget massa tempor,72
932,7/7/2022,aliquet massa id lobortis convallis tortor risus dapibus augue vel,95
933,9/5/2022,fermentum donec ut mauris eget massa tempor convallis nulla neque libero convallis eget eleifend luctus ultricies eu,51
934,3/23/2022,mauris non ligula pellentesque ultrices phasellus id,4
935,6/21/2022,non ligula pellentesque ultrices phasellus id sapien in sapien,159
936,2/6/2022,faucibus orci luctus et ultrices posuere cubilia curae mauris viverra diam vitae quam,158
937,4/14/2022,egestas metus aenean fermentum donec ut mauris eget massa tempor,124
938,8/13/2022,curabitur gravida nisi at nibh in,94
939,3/3/2022,nisl nunc nisl duis bibendum,105
940,9/9/2022,lacinia eget tincidunt eget tempus vel pede morbi porttitor lorem id ligula suspendisse ornare consequat,18
941,5/28/2022,porta volutpat erat quisque erat eros viverra eget congue eget semper rutrum nulla nunc,87
942,7/14/2022,pretium iaculis justo in hac habitasse platea dictumst etiam faucibus cursus urna ut tellus nulla ut erat id mauris,200
943,7/1/2022,felis sed interdum venenatis turpis enim blandit mi in porttitor pede justo,55
944,8/1/2022,in ante vestibulum ante ipsum primis,37
945,5/26/2022,nulla suscipit ligula in lacus curabitur at ipsum ac tellus semper interdum mauris ullamcorper purus sit amet nulla quisque,197
946,11/1/2022,natoque penatibus et magnis dis,106
947,1/23/2023,proin interdum mauris non ligula,168
948,7/17/2022,mus vivamus vestibulum sagittis sapien cum sociis natoque penatibus et magnis dis parturient montes,12
949,11/14/2022,urna pretium nisl ut volutpat sapien arcu sed augue aliquam,157
950,9/2/2022,mi nulla ac enim in tempor turpis nec euismod scelerisque quam turpis adipiscing lorem vitae mattis nibh ligula nec,55
951,7/1/2022,accumsan tellus nisi eu orci mauris lacinia,167
952,7/14/2022,vestibulum ante ipsum primis in faucibus orci luctus,84
953,5/5/2022,amet consectetuer adipiscing elit proin interdum mauris non ligula pellentesque ultrices phasellus id sapien in sapien iaculis,133
954,2/9/2022,odio donec vitae nisi nam ultrices libero non mattis pulvinar,1
955,7/1/2022,accumsan tellus nisi eu orci mauris lacinia sapien quis libero nullam sit amet turpis elementum ligula,19
956,9/4/2022,integer a nibh in quis justo,139
957,8/26/2022,consequat ut nulla sed accumsan felis ut at dolor quis odio,41
958,12/2/2022,tellus in sagittis dui vel nisl duis ac nibh fusce,185
959,7/14/2022,est phasellus sit amet erat nulla tempus vivamus in felis eu sapien cursus vestibulum proin eu mi,182
960,7/30/2022,amet eros suspendisse accumsan tortor quis turpis sed ante vivamus tortor duis mattis egestas metus aenean fermentum donec ut,123
961,2/11/2022,risus praesent lectus vestibulum quam sapien varius ut blandit non interdum in ante vestibulum,192
962,8/19/2022,amet consectetuer adipiscing elit proin risus praesent lectus vestibulum quam sapien varius,67
963,7/8/2022,proin eu mi nulla ac enim in tempor turpis nec euismod scelerisque quam,153
964,7/6/2022,pede posuere nonummy integer non velit donec diam neque vestibulum eget vulputate ut ultrices vel augue,185
965,10/3/2022,libero nam dui proin leo odio porttitor id consequat in consequat ut,157
966,12/18/2022,iaculis diam erat fermentum justo nec condimentum neque sapien placerat ante nulla justo aliquam quis turpis eget,81
967,7/23/2022,aliquam non mauris morbi non lectus aliquam sit amet diam in magna,21
968,12/31/2022,non mauris morbi non lectus,168
969,8/9/2022,ante ipsum primis in faucibus orci luctus et ultrices posuere cubilia curae mauris viverra diam vitae quam suspendisse,110
970,4/10/2022,et magnis dis parturient montes nascetur ridiculus mus etiam vel augue vestibulum rutrum rutrum neque aenean auctor gravida sem,168
971,4/17/2022,purus aliquet at feugiat non pretium quis lectus suspendisse potenti in eleifend quam,2
972,12/24/2022,turpis eget elit sodales scelerisque mauris sit amet eros,79
973,8/12/2022,vel nisl duis ac nibh fusce lacus,190
974,10/22/2022,quam sapien varius ut blandit non interdum in ante vestibulum ante ipsum primis,125
975,12/15/2022,nullam molestie nibh in lectus pellentesque at nulla,145
976,1/6/2023,vestibulum ante ipsum primis in faucibus orci luctus et ultrices posuere cubilia curae duis,12
977,3/30/2022,sodales scelerisque mauris sit amet eros suspendisse accumsan tortor quis turpis sed ante vivamus,55
978,1/14/2023,ut mauris eget massa tempor convallis nulla neque libero,1
979,2/21/2022,posuere cubilia curae donec pharetra magna vestibulum aliquet ultrices,184
980,9/27/2022,tincidunt lacus at velit vivamus vel nulla eget eros elementum pellentesque quisque porta volutpat erat quisque,126
981,4/23/2022,fusce posuere felis sed lacus morbi sem,153
982,5/26/2022,pede morbi porttitor lorem id ligula suspendisse ornare consequat lectus in est risus auctor sed tristique in,171
983,4/22/2022,nulla dapibus dolor vel est donec odio justo sollicitudin ut,11
984,7/20/2022,eget orci vehicula condimentum curabitur in libero,80
985,5/28/2022,sed sagittis nam congue risus semper porta volutpat quam pede lobortis ligula sit,93
986,2/25/2022,mi sit amet lobortis sapien sapien non mi integer ac neque duis bibendum morbi non quam nec dui,77
987,4/27/2022,proin eu mi nulla ac enim in tempor turpis nec euismod,27
988,3/24/2022,vel ipsum praesent blandit lacinia erat vestibulum sed magna at,185
989,1/24/2023,platea dictumst maecenas ut massa quis augue luctus tincidunt nulla mollis molestie lorem quisque ut erat curabitur gravida,36
990,6/28/2022,mauris viverra diam vitae quam suspendisse potenti nullam porttitor lacus at turpis donec posuere metus vitae ipsum aliquam non,165
991,7/16/2022,pretium nisl ut volutpat sapien arcu sed augue aliquam erat volutpat in congue,63
992,3/25/2022,nullam porttitor lacus at turpis donec posuere metus,34
993,5/8/2022,congue elementum in hac habitasse platea,77
994,9/4/2022,ante ipsum primis in faucibus orci luctus et ultrices posuere cubilia curae mauris viverra diam vitae quam,103
995,5/21/2022,lorem id ligula suspendisse ornare consequat lectus in est risus auctor,13
996,3/25/2022,hac habitasse platea dictumst morbi vestibulum velit id pretium iaculis diam erat fermentum justo nec,12
997,8/22/2022,mi in porttitor pede justo eu massa,200
998,9/12/2022,ante vivamus tortor duis mattis egestas metus aenean fermentum donec ut mauris eget,99
999,1/29/2022,augue aliquam erat volutpat in congue etiam justo etiam,7
1000,4/30/2022,eget orci vehicula condimentum curabitur in libero ut massa volutpat convallis morbi odio,110
