id,createdAt,content,authorId
282,11/2/2022,cubilia curae nulla dapibus dolor vel est donec odio justo sollicitudin ut suscipit,24
283,10/31/2022,hac habitasse platea dictumst morbi vestibulum velit id pretium iaculis diam erat,107
284,12/23/2022,fermentum justo nec condimentum neque sapien placerat ante nulla justo aliquam quis turpis eget elit sodales scelerisque mauris sit,181
285,1/5/2023,cras in purus eu magna vulputate luctus cum sociis natoque penatibus et magnis dis parturient montes nascetur ridiculus mus,7
286,3/30/2022,odio consequat varius integer ac leo pellentesque ultrices mattis odio donec vitae nisi,108
287,6/11/2022,justo aliquam quis turpis eget elit sodales scelerisque mauris sit amet eros suspendisse accumsan,145
288,9/28/2022,nulla integer pede justo lacinia,10
289,8/17/2022,sed nisl nunc rhoncus dui vel sem sed sagittis nam congue risus semper porta volutpat,143
290,9/28/2022,duis faucibus accumsan odio curabitur convallis duis consequat dui nec nisi volutpat,114
291,11/25/2022,ultrices libero non mattis pulvinar nulla pede ullamcorper augue a suscipit nulla elit ac nulla sed,144
292,3/18/2022,rutrum rutrum neque aenean auctor gravida sem praesent id massa id nisl venenatis lacinia aenean sit amet justo morbi ut,113
293,11/25/2022,interdum mauris ullamcorper purus sit amet nulla quisque arcu libero rutrum ac lobortis vel dapibus at diam,26
294,4/9/2022,montes nascetur ridiculus mus etiam vel augue vestibulum rutrum,108
295,6/15/2022,laoreet ut rhoncus aliquet pulvinar sed nisl nunc rhoncus dui vel sem sed sagittis nam,126
296,6/8/2022,sem mauris laoreet ut rhoncus aliquet pulvinar sed nisl nunc rhoncus dui vel sem sed,62
297,12/1/2022,elit ac nulla sed vel,6
298,10/10/2022,pellentesque viverra pede ac diam cras pellentesque volutpat dui maecenas tristique est et tempus semper est quam pharetra magna ac,6
299,5/3/2022,faucibus orci luctus et ultrices posuere cubilia curae nulla dapibus,52
300,12/11/2022,dolor sit amet consectetuer,76
301,8/26/2022,at feugiat non pretium quis lectus suspendisse potenti in eleifend quam a odio in hac habitasse,150
302,5/15/2022,interdum in ante vestibulum ante ipsum primis in faucibus orci luctus et ultrices posuere,102
303,12/29/2022,eget tempus vel pede morbi porttitor lorem id ligula suspendisse ornare consequat lectus in est risus auctor sed tristique in,94
304,7/10/2022,odio in hac habitasse platea dictumst maecenas ut massa quis augue luctus tincidunt nulla mollis molestie lorem quisque,140
305,1/24/2023,vestibulum ante ipsum primis in faucibus orci luctus et,144
306,8/9/2022,ut tellus nulla ut erat id,83
307,2/5/2022,ut suscipit a feugiat et eros vestibulum,74
308,1/24/2023,at nunc commodo placerat praesent,50
309,9/13/2022,nec condimentum neque sapien placerat ante nulla justo aliquam quis turpis eget elit sodales,79
310,1/7/2023,nonummy integer non velit donec diam neque vestibulum eget vulputate ut,194
311,11/27/2022,rhoncus aliquet pulvinar sed nisl nunc rhoncus dui vel sem sed sagittis nam congue risus semper porta volutpat quam,169
312,6/2/2022,lorem id ligula suspendisse ornare consequat lectus in est risus auctor sed tristique in tempus sit,76
313,4/2/2022,habitasse platea dictumst aliquam augue quam sollicitudin vitae consectetuer eget,119
314,1/31/2022,proin at turpis a pede posuere nonummy integer non velit donec,52
315,5/18/2022,amet consectetuer adipiscing elit proin risus praesent,115
316,1/29/2022,penatibus et magnis dis parturient montes nascetur ridiculus mus etiam vel augue vestibulum rutrum,193
317,4/5/2022,morbi ut odio cras mi,55
318,12/2/2022,erat volutpat in congue etiam justo etiam pretium iaculis justo in hac habitasse platea dictumst etiam faucibus cursus urna,58
319,8/22/2022,sed vel enim sit amet nunc viverra dapibus nulla suscipit ligula in lacus curabitur at,153
320,11/22/2022,phasellus sit amet erat nulla tempus vivamus in felis eu sapien cursus,151
321,4/5/2022,tortor duis mattis egestas metus aenean fermentum donec ut mauris eget,191
322,7/23/2022,justo in blandit ultrices enim lorem ipsum dolor sit amet consectetuer adipiscing elit proin interdum mauris non ligula pellentesque ultrices,20
323,2/12/2022,risus semper porta volutpat quam pede lobortis ligula sit amet eleifend pede libero quis orci nullam molestie nibh in lectus,114
324,10/26/2022,parturient montes nascetur ridiculus mus vivamus vestibulum sagittis sapien cum sociis natoque penatibus et,179
325,5/8/2022,ante vel ipsum praesent blandit lacinia erat vestibulum sed magna at nunc commodo placerat praesent,195
326,5/5/2022,ultrices libero non mattis pulvinar nulla pede ullamcorper augue a suscipit,160
327,1/27/2022,sit amet eros suspendisse accumsan tortor quis turpis sed ante vivamus tortor duis mattis,84
328,2/1/2022,faucibus accumsan odio curabitur convallis duis,179
329,3/7/2022,sed sagittis nam congue risus semper porta volutpat quam pede lobortis ligula sit amet eleifend pede libero quis orci nullam,55
330,10/8/2022,sapien sapien non mi integer ac neque duis bibendum morbi non quam nec dui luctus,147
331,1/16/2023,nam dui proin leo odio porttitor id consequat in consequat ut nulla sed accumsan felis,120
332,7/1/2022,felis ut at dolor quis odio consequat varius integer ac leo pellentesque,33
333,4/26/2022,orci luctus et ultrices posuere cubilia curae mauris viverra diam vitae quam suspendisse,29
334,7/2/2022,erat id mauris vulputate elementum nullam varius nulla facilisi cras non,38
335,3/2/2022,porttitor lorem id ligula suspendisse ornare consequat lectus in est risus auctor sed tristique in tempus sit amet sem fusce,156
336,11/19/2022,ac enim in tempor turpis nec euismod scelerisque quam turpis adipiscing lorem vitae mattis nibh ligula nec sem duis,29
337,2/26/2022,non interdum in ante vestibulum ante ipsum primis in,32
338,7/6/2022,ultrices posuere cubilia curae,100
339,12/28/2022,ridiculus mus etiam vel augue vestibulum rutrum rutrum,14
340,6/15/2022,donec ut mauris eget massa tempor convallis nulla neque libero convallis,145
341,4/22/2022,primis in faucibus orci luctus et ultrices,170
342,9/11/2022,sagittis nam congue risus semper porta volutpat quam pede lobortis ligula sit amet eleifend,100
343,2/2/2022,rutrum at lorem integer tincidunt ante vel ipsum praesent blandit lacinia erat vestibulum sed magna at nunc commodo placerat,84
344,3/30/2022,integer ac leo pellentesque ultrices mattis odio,131
345,3/13/2022,commodo vulputate justo in blandit ultrices enim lorem ipsum,105
346,11/5/2022,arcu sed augue aliquam erat volutpat in congue etiam justo etiam pretium iaculis justo in hac habitasse,133
347,10/18/2022,a suscipit nulla elit ac nulla sed vel enim sit amet nunc viverra dapibus,171
348,7/9/2022,suspendisse potenti cras in purus eu magna vulputate luctus cum sociis,52
349,2/12/2022,vestibulum sit amet cursus id turpis integer aliquet massa id lobortis convallis tortor risus dapibus augue,15
350,11/12/2022,dictumst morbi vestibulum velit id pretium iaculis diam erat fermentum justo,183
351,1/19/2023,morbi non quam nec dui luctus rutrum nulla tellus in sagittis dui,106
352,6/19/2022,at feugiat non pretium,158
353,5/14/2022,cum sociis natoque penatibus et magnis dis parturient montes nascetur ridiculus,94
354,7/26/2022,condimentum neque sapien placerat,73
355,7/20/2022,nam ultrices libero non mattis pulvinar nulla pede ullamcorper augue,139
356,7/11/2022,donec posuere metus vitae ipsum aliquam non mauris morbi non,15
357,7/20/2022,in felis eu sapien cursus vestibulum proin eu mi,180
358,5/23/2022,ligula vehicula consequat morbi a ipsum integer a nibh in quis justo maecenas rhoncus aliquam lacus morbi,103
359,9/19/2022,tempus vivamus in felis eu sapien cursus vestibulum proin eu mi nulla ac enim in tempor,100
360,5/30/2022,non mattis pulvinar nulla pede ullamcorper augue a suscipit nulla elit,135
361,11/30/2022,aliquam non mauris morbi non lectus aliquam sit amet diam in magna bibendum imperdiet nullam orci pede venenatis non,149
362,8/20/2022,in felis donec semper sapien a libero nam dui proin leo odio porttitor id consequat,158
363,11/29/2022,semper rutrum nulla nunc purus phasellus in felis donec semper sapien a libero nam dui,140
364,6/9/2022,libero quis orci nullam,199
365,5/29/2022,sit amet eleifend pede libero quis orci nullam molestie nibh in lectus pellentesque at nulla suspendisse,95
366,2/11/2022,nisl nunc rhoncus dui vel sem sed,188
367,9/21/2022,nam nulla integer pede justo lacinia eget tincidunt eget tempus vel pede,100
368,9/13/2022,eget tincidunt eget tempus vel pede morbi,113
369,12/12/2022,mollis molestie lorem quisque ut erat curabitur gravida nisi at nibh in hac habitasse platea dictumst aliquam,35
370,4/7/2022,enim leo rhoncus sed vestibulum sit amet cursus id turpis integer aliquet massa id,51
371,8/6/2022,aliquam non mauris morbi non lectus aliquam sit amet diam,104
372,4/28/2022,convallis tortor risus dapibus augue vel accumsan tellus nisi eu orci mauris lacinia sapien quis libero,20
373,10/20/2022,in hac habitasse platea dictumst etiam,147
374,5/25/2022,maecenas ut massa quis augue,103
375,9/12/2022,quisque ut erat curabitur gravida nisi at,77
376,11/18/2022,molestie sed justo pellentesque viverra pede ac diam,116
377,2/27/2022,iaculis congue vivamus metus arcu adipiscing molestie hendrerit at vulputate vitae nisl aenean lectus pellentesque,39
378,4/4/2022,vestibulum ante ipsum primis in faucibus orci luctus et ultrices posuere cubilia curae mauris viverra diam vitae quam suspendisse potenti,101
379,10/29/2022,habitasse platea dictumst aliquam augue quam sollicitudin vitae consectetuer eget rutrum at lorem integer tincidunt,1
380,3/8/2022,in lectus pellentesque at nulla suspendisse potenti cras in purus eu magna vulputate luctus,25
381,8/9/2022,mi nulla ac enim in tempor turpis nec euismod scelerisque quam turpis adipiscing lorem vitae mattis nibh ligula nec,70
382,3/23/2022,consectetuer adipiscing elit proin interdum mauris non ligula pellentesque ultrices phasellus id sapien in sapien iaculis congue vivamus metus,17
383,3/5/2022,sed lacus morbi sem mauris laoreet ut rhoncus aliquet pulvinar sed nisl nunc rhoncus dui vel sem sed sagittis nam,37
384,1/11/2023,ligula pellentesque ultrices phasellus id sapien in,183
385,10/30/2022,massa donec dapibus duis at velit eu,94
386,11/11/2022,id mauris vulputate elementum nullam varius nulla facilisi,2
387,4/24/2022,felis sed interdum venenatis turpis enim blandit mi in porttitor pede justo eu massa donec dapibus duis at velit,21
388,12/17/2022,at dolor quis odio consequat,80
389,4/12/2022,vulputate luctus cum sociis natoque penatibus et magnis dis parturient montes nascetur ridiculus mus,82
390,9/17/2022,in tempor turpis nec euismod,146
391,11/15/2022,nec dui luctus rutrum nulla tellus in,112
392,12/19/2022,nisl venenatis lacinia aenean,16
393,10/9/2022,imperdiet sapien urna pretium,198
394,11/6/2022,erat id mauris vulputate elementum nullam varius nulla,93
395,7/6/2022,quam a odio in hac habitasse platea dictumst maecenas ut massa quis augue luctus tincidunt nulla mollis,179
396,9/22/2022,sem fusce consequat nulla nisl nunc nisl duis bibendum felis sed interdum venenatis turpis enim blandit mi,107
397,5/10/2022,magna at nunc commodo placerat praesent blandit nam nulla integer pede justo lacinia eget tincidunt,95
398,10/3/2022,morbi sem mauris laoreet ut rhoncus aliquet pulvinar sed nisl,190
399,4/27/2022,tristique in tempus sit amet sem fusce consequat nulla nisl nunc nisl duis bibendum felis,180
400,8/23/2022,metus sapien ut nunc vestibulum,42
401,6/3/2022,tincidunt eget tempus vel pede morbi porttitor lorem,129
402,7/24/2022,habitasse platea dictumst morbi vestibulum velit id pretium iaculis diam erat fermentum justo nec condimentum neque sapien placerat ante nulla,136
403,5/8/2022,morbi porttitor lorem id ligula suspendisse ornare consequat,22
404,2/1/2022,mauris laoreet ut rhoncus aliquet pulvinar sed nisl nunc rhoncus dui vel sem sed sagittis nam congue,92
405,6/3/2022,aliquam lacus morbi quis tortor id nulla ultrices aliquet maecenas leo odio condimentum id luctus nec molestie sed justo pellentesque,3
406,6/17/2022,mauris morbi non lectus aliquam sit amet diam in magna,64
407,9/14/2022,sit amet erat nulla tempus vivamus in felis eu sapien cursus vestibulum proin eu mi nulla ac enim in,46
408,6/6/2022,proin eu mi nulla ac enim in tempor turpis nec euismod,111
409,11/10/2022,suscipit ligula in lacus curabitur,94
410,4/2/2022,vulputate luctus cum sociis natoque penatibus,190
411,10/15/2022,a ipsum integer a nibh in,118
412,1/7/2023,dolor sit amet consectetuer adipiscing elit proin,43
413,2/8/2022,in eleifend quam a odio,94
414,9/15/2022,sed augue aliquam erat,68
415,11/30/2022,vel pede morbi porttitor lorem id ligula suspendisse,92
416,3/28/2022,nec dui luctus rutrum,199
417,11/23/2022,vulputate luctus cum sociis natoque penatibus et magnis dis parturient montes nascetur ridiculus mus vivamus vestibulum sagittis sapien cum,141
418,1/5/2023,ut rhoncus aliquet pulvinar sed nisl nunc rhoncus dui vel sem sed sagittis nam,157
419,11/5/2022,ac est lacinia nisi venenatis tristique fusce congue diam id ornare imperdiet sapien urna pretium nisl ut,197
420,12/8/2022,sed tristique in tempus sit amet sem fusce consequat nulla nisl nunc nisl duis bibendum felis sed interdum venenatis turpis,99
421,11/5/2022,massa tempor convallis nulla neque libero convallis eget eleifend luctus ultricies eu,54
422,6/20/2022,libero nullam sit amet turpis elementum ligula vehicula consequat morbi a ipsum,184
423,3/24/2022,vestibulum sed magna at nunc commodo placerat praesent blandit nam nulla integer pede justo,86
424,1/7/2023,amet turpis elementum ligula vehicula consequat morbi a ipsum integer a nibh in,55
425,4/8/2022,massa quis augue luctus tincidunt nulla mollis molestie lorem quisque ut erat curabitur gravida nisi at nibh in,139
426,9/10/2022,tempus vivamus in felis eu sapien cursus vestibulum proin eu mi,132
427,9/8/2022,lacus morbi sem mauris laoreet ut rhoncus aliquet,186
428,7/3/2022,orci luctus et ultrices posuere cubilia curae donec pharetra magna vestibulum aliquet ultrices erat tortor sollicitudin mi sit,81
429,7/18/2022,at nibh in hac habitasse platea dictumst aliquam,16
430,5/23/2022,sagittis nam congue risus semper porta volutpat quam pede lobortis ligula,59
431,10/2/2022,ut blandit non interdum in ante vestibulum ante ipsum primis in faucibus orci luctus et ultrices,116
432,8/31/2022,amet eros suspendisse accumsan tortor quis turpis sed ante,115
433,8/5/2022,porttitor pede justo eu massa donec dapibus duis at velit eu est congue elementum,178
434,10/30/2022,praesent id massa id nisl venenatis lacinia aenean sit amet justo morbi ut odio cras mi pede,19
435,8/1/2022,sapien ut nunc vestibulum ante ipsum primis in faucibus orci luctus et ultrices posuere cubilia curae mauris viverra,33
436,8/20/2022,odio consequat varius integer ac,144
437,12/30/2022,vel est donec odio justo,143
438,2/22/2022,ligula sit amet eleifend pede libero quis,179
439,9/3/2022,auctor sed tristique in tempus sit amet sem fusce consequat nulla nisl nunc nisl duis bibendum,88
440,8/28/2022,pede posuere nonummy integer non velit donec diam neque vestibulum eget vulputate ut ultrices,102
441,1/16/2023,suscipit nulla elit ac nulla sed vel enim sit amet nunc viverra dapibus nulla suscipit ligula in,193
442,5/8/2022,quisque ut erat curabitur gravida nisi,182
443,10/7/2022,nulla pede ullamcorper augue a suscipit nulla elit ac nulla sed vel enim sit amet nunc viverra dapibus,51
444,5/8/2022,pharetra magna vestibulum aliquet ultrices erat tortor sollicitudin mi sit,55
445,11/14/2022,accumsan tellus nisi eu orci mauris lacinia,117
446,9/15/2022,montes nascetur ridiculus mus vivamus vestibulum sagittis sapien cum sociis natoque penatibus et magnis,141
447,9/18/2022,ante ipsum primis in faucibus orci luctus et ultrices posuere cubilia curae,162
448,3/23/2022,aliquet at feugiat non pretium quis lectus suspendisse potenti in eleifend quam a odio in hac habitasse platea dictumst,106
449,4/29/2022,in eleifend quam a,157
450,11/3/2022,nisi at nibh in hac habitasse platea dictumst aliquam augue quam,43
451,10/26/2022,nunc purus phasellus in felis donec,1
452,11/13/2022,at velit vivamus vel,113
453,2/12/2022,nisi nam ultrices libero non mattis pulvinar nulla pede ullamcorper augue,8
454,5/28/2022,odio elementum eu interdum eu tincidunt in leo maecenas pulvinar lobortis est phasellus sit amet erat,165
455,12/26/2022,imperdiet sapien urna pretium nisl ut volutpat sapien arcu sed augue aliquam,137
456,7/7/2022,id mauris vulputate elementum nullam,86
457,4/27/2022,tempus vel pede morbi porttitor lorem id ligula suspendisse ornare consequat lectus in est risus auctor sed tristique,103
458,12/21/2022,id lobortis convallis tortor risus dapibus augue vel accumsan tellus nisi eu orci mauris lacinia sapien quis libero nullam,173
459,3/17/2022,id lobortis convallis tortor risus dapibus augue vel accumsan tellus nisi eu orci,113
460,5/20/2022,a ipsum integer a nibh in quis justo maecenas rhoncus aliquam lacus morbi quis tortor id,146
461,7/27/2022,purus eu magna vulputate luctus cum sociis natoque penatibus et magnis,79
462,2/22/2022,erat curabitur gravida nisi at,110
463,11/26/2022,eu nibh quisque id justo sit amet sapien dignissim,169
464,11/7/2022,sapien cum sociis natoque penatibus et magnis dis parturient montes nascetur ridiculus mus etiam vel augue,169
465,4/5/2022,lectus in quam fringilla rhoncus mauris enim leo rhoncus sed,29
466,7/28/2022,dui vel sem sed sagittis nam congue risus,152
467,11/27/2022,consequat metus sapien ut nunc,122
468,9/14/2022,ac diam cras pellentesque volutpat dui,111
469,7/20/2022,faucibus orci luctus et ultrices posuere cubilia curae nulla dapibus dolor vel est donec odio,111
470,2/22/2022,potenti nullam porttitor lacus at turpis donec posuere metus vitae,167
471,5/23/2022,eget rutrum at lorem integer tincidunt ante vel ipsum praesent blandit lacinia erat vestibulum sed magna at nunc commodo placerat,180
472,10/31/2022,rutrum at lorem integer tincidunt ante vel ipsum praesent blandit lacinia erat vestibulum sed magna,158
473,12/27/2022,a pede posuere nonummy integer non velit,180
474,5/18/2022,sed vel enim sit amet nunc viverra dapibus nulla suscipit ligula in,44
475,9/11/2022,pede venenatis non sodales sed tincidunt eu felis,27
476,3/1/2022,mi pede malesuada in imperdiet et commodo vulputate justo,86
477,5/16/2022,proin eu mi nulla ac enim in tempor turpis nec,78
478,9/24/2022,adipiscing molestie hendrerit at vulputate vitae nisl aenean lectus pellentesque eget nunc donec quis orci eget orci vehicula condimentum,95
479,7/19/2022,congue elementum in hac habitasse platea dictumst morbi vestibulum velit id pretium iaculis diam erat fermentum,102
480,7/26/2022,lectus pellentesque eget nunc donec quis orci eget orci vehicula condimentum curabitur in libero ut massa volutpat convallis morbi,191
481,7/21/2022,in imperdiet et commodo vulputate justo in blandit ultrices enim lorem ipsum dolor sit amet consectetuer adipiscing,42
482,12/22/2022,mauris lacinia sapien quis libero nullam sit amet turpis elementum ligula vehicula consequat morbi a ipsum,144
483,12/12/2022,morbi a ipsum integer a,142
484,9/5/2022,eu interdum eu tincidunt in leo maecenas pulvinar lobortis est phasellus sit amet erat,61
485,2/11/2022,amet sapien dignissim vestibulum vestibulum ante ipsum primis in faucibus orci luctus et ultrices posuere cubilia curae nulla dapibus,67
486,6/30/2022,ut tellus nulla ut erat id mauris vulputate elementum nullam varius nulla facilisi cras non velit nec nisi vulputate,170
487,12/25/2022,neque vestibulum eget vulputate ut ultrices vel augue vestibulum ante ipsum primis in,11
488,9/25/2022,dui vel nisl duis ac nibh fusce lacus purus aliquet at feugiat non pretium quis lectus suspendisse,13
489,1/22/2023,tortor risus dapibus augue vel accumsan tellus,6
490,5/7/2022,erat tortor sollicitudin mi sit amet lobortis sapien sapien non mi integer ac neque duis bibendum morbi non quam nec,105
491,3/29/2022,leo pellentesque ultrices mattis odio donec vitae nisi nam ultrices libero non mattis pulvinar nulla pede ullamcorper augue a,159
492,4/25/2022,justo eu massa donec dapibus duis at velit eu est congue elementum,173
493,5/23/2022,fusce congue diam id ornare imperdiet sapien urna pretium nisl ut volutpat sapien arcu sed augue aliquam erat volutpat,144
494,10/4/2022,enim in tempor turpis nec euismod scelerisque quam turpis adipiscing lorem,161
495,6/5/2022,sem fusce consequat nulla nisl nunc nisl duis,165
496,1/1/2023,orci luctus et ultrices posuere,98
497,11/6/2022,velit eu est congue elementum in hac habitasse platea dictumst morbi vestibulum velit id pretium iaculis,31
498,7/18/2022,interdum in ante vestibulum ante ipsum primis in faucibus orci luctus et ultrices posuere cubilia curae duis faucibus accumsan,57
499,10/3/2022,nullam sit amet turpis,106
500,10/23/2022,morbi odio odio elementum eu interdum eu tincidunt in leo maecenas,27
501,2/17/2022,lacus morbi sem mauris laoreet ut,104
502,2/5/2022,lectus pellentesque eget nunc donec quis orci eget orci vehicula condimentum curabitur in libero ut massa volutpat convallis morbi odio,68
503,10/10/2022,dictumst aliquam augue quam sollicitudin vitae consectetuer,62
504,4/1/2022,dolor quis odio consequat varius integer ac leo pellentesque ultrices,18
505,11/1/2022,tempor convallis nulla neque libero convallis eget eleifend luctus ultricies eu nibh quisque id,58
506,6/29/2022,non mi integer ac neque duis,88
507,9/30/2022,odio in hac habitasse platea dictumst maecenas ut massa quis augue luctus tincidunt nulla,149
508,3/21/2022,mi pede malesuada in imperdiet et commodo vulputate justo in blandit ultrices enim lorem ipsum dolor sit amet consectetuer adipiscing,39
509,9/12/2022,primis in faucibus orci luctus et,165
510,10/16/2022,quis augue luctus tincidunt nulla mollis molestie lorem quisque ut erat curabitur gravida,135
511,4/24/2022,odio donec vitae nisi nam ultrices libero non mattis pulvinar nulla pede,162
512,10/8/2022,mi sit amet lobortis sapien sapien,118
513,7/27/2022,eu est congue elementum in hac habitasse platea,199
514,12/3/2022,sollicitudin vitae consectetuer eget rutrum at lorem integer tincidunt ante vel ipsum praesent,143
515,12/4/2022,ultrices posuere cubilia curae donec pharetra magna,178
516,4/19/2022,congue vivamus metus arcu adipiscing molestie hendrerit at vulputate vitae nisl aenean lectus,154
517,1/3/2023,primis in faucibus orci luctus et ultrices posuere cubilia curae mauris viverra diam vitae quam suspendisse,134
518,3/1/2022,varius ut blandit non interdum,19
519,9/17/2022,amet eros suspendisse accumsan tortor quis turpis sed ante vivamus,182
520,10/21/2022,justo maecenas rhoncus aliquam lacus morbi quis tortor id nulla ultrices,166
521,6/22/2022,augue vestibulum rutrum rutrum neque aenean auctor gravida sem praesent id massa id nisl venenatis lacinia aenean sit amet,5
522,1/10/2023,lorem ipsum dolor sit amet,163
523,8/2/2022,rutrum nulla tellus in sagittis dui vel nisl duis ac nibh fusce lacus purus,67
524,9/16/2022,etiam justo etiam pretium,145
525,8/27/2022,dui proin leo odio porttitor,57
526,7/9/2022,in hac habitasse platea dictumst aliquam augue quam sollicitudin,92
527,9/27/2022,risus praesent lectus vestibulum quam sapien varius ut,103
528,8/13/2022,justo lacinia eget tincidunt eget tempus vel pede morbi porttitor lorem id ligula suspendisse,69
529,12/8/2022,venenatis tristique fusce congue diam id ornare imperdiet sapien urna pretium nisl ut volutpat sapien arcu sed augue,82
530,4/19/2022,sapien dignissim vestibulum vestibulum ante ipsum primis in faucibus orci luctus et ultrices posuere cubilia,107
531,9/4/2022,sapien cursus vestibulum proin eu mi nulla ac enim in tempor,39
532,9/21/2022,elit ac nulla sed vel enim sit amet nunc viverra dapibus,44
533,4/8/2022,id luctus nec molestie sed justo pellentesque viverra pede ac diam cras pellentesque volutpat dui maecenas tristique est et tempus,84
534,3/2/2022,magna vulputate luctus cum sociis,115
535,6/18/2022,consectetuer adipiscing elit proin risus praesent lectus vestibulum quam sapien,82
536,4/11/2022,faucibus accumsan odio curabitur convallis duis consequat dui nec,141
537,12/8/2022,montes nascetur ridiculus mus vivamus vestibulum sagittis sapien cum sociis natoque penatibus et,120
538,6/14/2022,vel lectus in quam fringilla rhoncus mauris enim leo rhoncus sed vestibulum sit amet cursus id turpis,28
539,4/23/2022,habitasse platea dictumst maecenas ut massa quis augue luctus tincidunt nulla mollis molestie lorem quisque ut,13
540,2/27/2022,sapien placerat ante nulla justo aliquam quis turpis eget elit sodales scelerisque mauris sit amet,129
541,3/25/2022,dignissim vestibulum vestibulum ante ipsum primis in faucibus orci luctus et,139
542,9/18/2022,dictumst etiam faucibus cursus urna ut tellus nulla ut erat,164
543,1/30/2022,interdum mauris ullamcorper purus sit amet nulla quisque arcu libero,103
544,7/8/2022,auctor sed tristique in tempus sit amet sem,47
545,7/28/2022,integer ac neque duis bibendum morbi non quam nec dui luctus rutrum nulla tellus in sagittis,167
546,3/23/2022,eros elementum pellentesque quisque porta volutpat erat,171
547,12/1/2022,scelerisque mauris sit amet eros suspendisse accumsan tortor quis turpis sed,35
548,4/22/2022,odio donec vitae nisi nam ultrices libero non mattis pulvinar nulla pede ullamcorper augue a suscipit nulla elit,157
549,7/10/2022,felis donec semper sapien a libero nam dui proin leo,99
550,9/7/2022,ut massa volutpat convallis morbi odio odio elementum eu interdum eu tincidunt,5
551,12/23/2022,luctus et ultrices posuere cubilia curae donec pharetra,176
552,6/8/2022,purus phasellus in felis donec,23
553,10/20/2022,fringilla rhoncus mauris enim leo rhoncus sed vestibulum sit amet cursus id turpis integer aliquet,130
554,8/15/2022,aenean lectus pellentesque eget nunc donec quis orci eget orci vehicula condimentum curabitur in,192
555,8/27/2022,vestibulum ante ipsum primis in,54
556,2/20/2022,id ornare imperdiet sapien urna pretium,82
