id,createdAt,content,authorId
1,8/31/2022,vehicula condimentum curabitur in libero,117
2,3/12/2022,at vulputate vitae nisl aenean lectus pellentesque eget nunc donec quis orci,76
3,11/26/2022,adipiscing elit proin interdum mauris non ligula pellentesque ultrices phasellus id,37
4,5/5/2022,eu felis fusce posuere felis sed lacus morbi sem mauris laoreet ut rhoncus aliquet pulvinar sed nisl,102
5,12/1/2022,sit amet consectetuer adipiscing elit,78
6,5/19/2022,nisi at nibh in hac habitasse platea dictumst,85
7,4/7/2022,nulla ultrices aliquet maecenas leo,124
8,1/12/2023,sodales scelerisque mauris sit amet eros suspendisse accumsan tortor quis turpis sed ante vivamus tortor duis mattis egestas,80
9,10/31/2022,sed lacus morbi sem mauris laoreet ut rhoncus aliquet pulvinar sed nisl nunc rhoncus dui vel sem,54
10,12/19/2022,praesent id massa id nisl venenatis lacinia aenean sit amet justo morbi ut odio cras mi pede,83
11,1/1/2023,suspendisse ornare consequat lectus in est risus auctor sed tristique in tempus sit amet sem,18
12,5/19/2022,posuere cubilia curae mauris viverra,89
13,10/18/2022,eu nibh quisque id justo sit amet sapien dignissim,58
14,1/31/2022,ultrices posuere cubilia curae nulla dapibus dolor vel est donec odio,162
15,9/30/2022,posuere cubilia curae nulla dapibus dolor vel est donec odio justo sollicitudin ut suscipit a,176
16,5/28/2022,elementum pellentesque quisque porta volutpat erat quisque erat eros viverra eget congue eget semper rutrum nulla,75
17,9/22/2022,in congue etiam justo etiam pretium iaculis justo in hac,74
18,5/14/2022,volutpat erat quisque erat eros viverra eget congue eget semper rutrum nulla nunc purus phasellus in felis donec semper,106
19,2/22/2022,in est risus auctor sed tristique in tempus sit amet,94
20,9/24/2022,adipiscing elit proin risus praesent lectus vestibulum,28
21,10/21/2022,vel augue vestibulum ante ipsum primis,14
22,12/12/2022,vulputate nonummy maecenas tincidunt lacus at velit vivamus vel nulla eget eros elementum pellentesque quisque porta,63
23,3/3/2022,rhoncus dui vel sem sed sagittis nam congue risus semper porta volutpat quam pede lobortis ligula sit,99
24,7/2/2022,quam sollicitudin vitae consectetuer,163
25,6/18/2022,eu orci mauris lacinia sapien quis libero nullam sit amet turpis elementum ligula vehicula consequat,118
26,6/28/2022,mi pede malesuada in,117
27,7/25/2022,sagittis sapien cum sociis natoque penatibus et magnis dis parturient montes,105
28,3/31/2022,vestibulum ante ipsum primis in faucibus orci luctus et ultrices,178
29,8/22/2022,vestibulum ante ipsum primis in faucibus orci luctus et ultrices posuere cubilia curae mauris viverra diam vitae quam suspendisse potenti,106
30,6/18/2022,praesent blandit lacinia erat vestibulum sed magna at nunc commodo placerat praesent blandit nam nulla integer pede justo,156
31,7/2/2022,luctus tincidunt nulla mollis molestie lorem quisque ut erat curabitur gravida nisi,138
32,5/5/2022,nulla tellus in sagittis dui vel nisl duis ac,52
33,10/26/2022,parturient montes nascetur ridiculus mus vivamus vestibulum sagittis sapien cum sociis natoque penatibus et magnis dis parturient montes nascetur ridiculus,151
34,3/21/2022,nulla justo aliquam quis turpis eget elit sodales,180
35,8/3/2022,suspendisse potenti nullam porttitor lacus at turpis donec posuere metus vitae ipsum aliquam non mauris morbi non lectus aliquam sit,121
36,6/27/2022,sit amet erat nulla tempus vivamus in felis eu sapien cursus vestibulum proin eu mi nulla,150
37,8/13/2022,penatibus et magnis dis parturient montes nascetur,41
38,1/2/2023,lorem vitae mattis nibh ligula nec sem duis aliquam convallis nunc proin,12
39,7/10/2022,mollis molestie lorem quisque ut erat curabitur gravida nisi at nibh in hac,62
40,6/5/2022,orci luctus et ultrices,189
41,9/30/2022,curabitur gravida nisi at nibh in hac habitasse platea dictumst aliquam augue quam sollicitudin vitae consectetuer eget rutrum at lorem,144
42,2/10/2022,cras non velit nec nisi vulputate nonummy maecenas tincidunt lacus at velit vivamus vel nulla eget eros elementum pellentesque quisque,132
43,9/7/2022,felis donec semper sapien a libero nam dui proin leo odio porttitor id consequat in consequat ut,114
44,2/6/2022,nisi nam ultrices libero non mattis pulvinar nulla pede ullamcorper,79
45,12/14/2022,enim sit amet nunc viverra dapibus nulla suscipit ligula in lacus curabitur at ipsum ac tellus semper interdum,191
46,12/11/2022,erat nulla tempus vivamus in felis eu sapien cursus vestibulum proin eu mi nulla ac enim in tempor turpis nec,136
47,12/23/2022,in congue etiam justo etiam pretium iaculis justo in hac habitasse platea dictumst,79
48,4/24/2022,mattis nibh ligula nec,49
49,3/18/2022,in faucibus orci luctus et ultrices,60
50,9/23/2022,in leo maecenas pulvinar lobortis,61
51,4/1/2022,ultricies eu nibh quisque id justo sit amet sapien dignissim vestibulum vestibulum ante,52
52,7/6/2022,suspendisse accumsan tortor quis turpis sed ante vivamus tortor duis mattis egestas metus aenean fermentum,130
53,10/14/2022,enim in tempor turpis nec euismod scelerisque quam turpis adipiscing lorem vitae mattis nibh ligula nec sem duis aliquam convallis,75
54,11/19/2022,amet turpis elementum ligula vehicula consequat morbi a,191
55,4/20/2022,vel nisl duis ac nibh fusce lacus purus aliquet at feugiat non pretium,38
56,12/3/2022,commodo placerat praesent blandit nam nulla integer pede justo lacinia eget tincidunt eget tempus vel,133
57,12/11/2022,non mattis pulvinar nulla pede ullamcorper augue a suscipit nulla elit,69
58,3/8/2022,risus auctor sed tristique in tempus sit,131
59,9/28/2022,rhoncus aliquam lacus morbi,196
60,3/5/2022,urna ut tellus nulla ut erat id mauris vulputate elementum nullam varius,167
61,10/15/2022,eleifend pede libero quis orci nullam molestie nibh in lectus pellentesque at nulla suspendisse potenti cras in,138
62,10/18/2022,purus sit amet nulla quisque arcu libero rutrum ac lobortis vel dapibus at diam,90
63,3/12/2022,lorem ipsum dolor sit amet consectetuer adipiscing elit,70
64,10/14/2022,risus semper porta volutpat quam pede lobortis ligula sit amet eleifend pede libero,105
65,10/8/2022,aenean fermentum donec ut mauris eget,165
66,5/4/2022,bibendum imperdiet nullam orci pede venenatis non sodales sed tincidunt eu felis fusce posuere felis sed lacus,31
67,1/11/2023,quis justo maecenas rhoncus aliquam lacus morbi quis tortor id,6
68,8/3/2022,vitae nisi nam ultrices libero non mattis,164
69,2/9/2022,rhoncus mauris enim leo rhoncus sed vestibulum sit amet,31
70,11/17/2022,erat volutpat in congue etiam,111
71,3/22/2022,augue luctus tincidunt nulla mollis molestie lorem quisque ut erat curabitur gravida nisi at nibh in hac,85
72,2/17/2022,quis justo maecenas rhoncus aliquam lacus morbi quis tortor id,41
73,4/11/2022,tincidunt ante vel ipsum praesent blandit lacinia erat vestibulum sed magna at nunc commodo placerat praesent,175
74,7/12/2022,duis faucibus accumsan odio curabitur convallis duis consequat dui nec nisi volutpat eleifend donec ut dolor morbi,87
75,8/17/2022,integer ac leo pellentesque ultrices mattis odio donec vitae nisi nam ultrices,43
76,3/28/2022,nisl nunc nisl duis,179
77,9/7/2022,et ultrices posuere cubilia,66
78,11/2/2022,ipsum primis in faucibus orci,112
79,11/28/2022,dis parturient montes nascetur ridiculus mus vivamus vestibulum sagittis sapien cum sociis natoque penatibus,78
80,5/28/2022,donec diam neque vestibulum eget vulputate ut ultrices vel augue vestibulum ante ipsum primis in faucibus orci luctus et ultrices,28
81,7/16/2022,ullamcorper purus sit amet nulla quisque arcu libero rutrum ac lobortis vel dapibus at diam nam tristique tortor,51
82,11/20/2022,vulputate ut ultrices vel augue vestibulum ante ipsum,78
83,9/3/2022,in faucibus orci luctus et ultrices posuere cubilia curae mauris viverra diam,157
84,3/2/2022,sapien arcu sed augue aliquam erat volutpat,169
85,12/30/2022,augue aliquam erat volutpat,11
86,6/24/2022,neque sapien placerat ante nulla justo aliquam quis turpis eget elit sodales scelerisque mauris sit,151
87,11/30/2022,quam nec dui luctus rutrum nulla tellus in sagittis,147
88,9/8/2022,dapibus dolor vel est donec,68
89,8/26/2022,sollicitudin vitae consectetuer eget rutrum at lorem,80
90,12/5/2022,rutrum nulla nunc purus phasellus in felis donec semper sapien a libero nam dui proin,94
91,8/21/2022,potenti cras in purus eu magna vulputate luctus cum sociis natoque penatibus et magnis dis parturient,102
92,12/2/2022,morbi ut odio cras mi pede malesuada in imperdiet et commodo vulputate justo in,83
93,3/8/2022,est et tempus semper est quam pharetra magna ac consequat metus sapien ut,4
94,2/25/2022,faucibus orci luctus et ultrices posuere cubilia curae nulla dapibus dolor vel,13
95,4/13/2022,enim leo rhoncus sed vestibulum sit amet cursus,87
96,5/24/2022,est congue elementum in hac habitasse platea dictumst morbi vestibulum velit id pretium,44
97,4/23/2022,erat curabitur gravida nisi at nibh in hac habitasse platea dictumst aliquam augue quam sollicitudin vitae consectetuer eget rutrum,155
98,9/14/2022,adipiscing lorem vitae mattis nibh ligula nec sem duis aliquam convallis nunc proin at turpis a pede posuere nonummy,4
99,6/21/2022,odio consequat varius integer ac leo pellentesque ultrices mattis odio donec vitae nisi nam ultrices,106
100,9/3/2022,ante ipsum primis in faucibus orci luctus et ultrices posuere cubilia curae nulla dapibus dolor vel,46
101,10/28/2022,platea dictumst morbi vestibulum velit id pretium,48
102,8/17/2022,at vulputate vitae nisl,17
103,4/4/2022,eu mi nulla ac enim,118
104,3/13/2022,diam neque vestibulum eget vulputate ut ultrices,51
105,12/25/2022,fermentum justo nec condimentum neque sapien placerat ante nulla justo aliquam quis turpis eget elit sodales scelerisque,167
106,11/13/2022,nunc nisl duis bibendum felis,7
107,5/6/2022,sapien varius ut blandit non interdum in ante vestibulum ante ipsum primis in faucibus orci,158
108,1/22/2023,neque vestibulum eget vulputate ut ultrices vel augue vestibulum ante ipsum,64
109,10/5/2022,lobortis ligula sit amet eleifend pede libero quis orci nullam molestie nibh in,181
110,8/29/2022,amet nunc viverra dapibus nulla suscipit,161
111,5/22/2022,habitasse platea dictumst maecenas ut massa quis augue luctus tincidunt nulla mollis,33
112,2/19/2022,pellentesque quisque porta volutpat erat quisque erat eros viverra eget congue eget semper rutrum nulla nunc,163
113,5/20/2022,suscipit a feugiat et,156
114,1/26/2022,ornare imperdiet sapien urna pretium nisl ut volutpat sapien arcu sed augue aliquam erat volutpat in,96
115,11/9/2022,morbi non quam nec dui luctus rutrum nulla tellus,167
116,5/8/2022,sem sed sagittis nam congue risus semper porta volutpat quam pede,110
117,3/12/2022,orci pede venenatis non sodales sed tincidunt eu felis fusce posuere felis,115
118,4/2/2022,etiam pretium iaculis justo in hac habitasse platea dictumst etiam faucibus cursus urna ut tellus nulla ut,66
119,5/25/2022,accumsan odio curabitur convallis duis consequat dui nec nisi volutpat eleifend donec ut dolor morbi,193
120,5/26/2022,morbi non lectus aliquam sit amet diam,97
121,4/1/2022,integer ac neque duis bibendum morbi,162
122,10/16/2022,montes nascetur ridiculus mus vivamus vestibulum sagittis sapien cum sociis natoque penatibus et magnis dis parturient montes nascetur ridiculus mus,104
123,7/14/2022,sapien a libero nam dui proin leo odio porttitor id consequat in consequat ut nulla sed accumsan felis ut at,165
124,6/20/2022,luctus et ultrices posuere cubilia curae nulla dapibus dolor vel,95
125,8/24/2022,sit amet cursus id turpis integer aliquet massa id lobortis convallis tortor risus dapibus augue vel,23
126,3/2/2022,morbi a ipsum integer a nibh in quis justo maecenas rhoncus aliquam lacus morbi quis tortor id nulla ultrices aliquet,107
127,12/24/2022,consectetuer adipiscing elit proin interdum mauris non ligula pellentesque ultrices phasellus id sapien in,131
128,12/25/2022,nullam varius nulla facilisi cras non velit nec nisi vulputate nonummy maecenas tincidunt lacus,30
129,7/12/2022,elit proin interdum mauris non ligula,98
130,12/4/2022,interdum mauris ullamcorper purus sit amet nulla quisque arcu libero rutrum ac lobortis vel dapibus at diam,110
131,6/6/2022,lobortis convallis tortor risus dapibus augue vel accumsan tellus nisi eu orci mauris lacinia sapien quis libero nullam,65
132,6/4/2022,imperdiet nullam orci pede venenatis non sodales sed tincidunt eu felis fusce posuere felis sed lacus,64
133,3/31/2022,tempus semper est quam pharetra magna ac consequat metus sapien,49
134,10/7/2022,id justo sit amet sapien dignissim vestibulum vestibulum ante ipsum primis in faucibus orci luctus et ultrices posuere cubilia,149
135,7/20/2022,mi in porttitor pede justo eu massa donec dapibus duis at velit eu est congue elementum in hac habitasse platea,163
136,10/12/2022,amet consectetuer adipiscing elit proin interdum mauris non ligula pellentesque ultrices,94
137,5/26/2022,pellentesque quisque porta volutpat erat quisque erat eros viverra eget congue eget semper rutrum nulla nunc purus phasellus in,193
138,10/4/2022,parturient montes nascetur ridiculus mus vivamus vestibulum sagittis sapien cum sociis natoque penatibus et magnis dis,181
139,5/29/2022,vestibulum ante ipsum primis in faucibus,62
140,12/5/2022,in faucibus orci luctus et,160
141,4/14/2022,nisl aenean lectus pellentesque eget nunc donec,77
142,3/13/2022,non sodales sed tincidunt eu felis fusce posuere felis sed lacus morbi sem mauris laoreet ut,72
143,5/25/2022,a feugiat et eros vestibulum ac est lacinia nisi venenatis tristique,162
144,7/14/2022,in faucibus orci luctus,170
145,7/23/2022,lobortis ligula sit amet eleifend pede,58
146,9/10/2022,venenatis lacinia aenean sit amet justo morbi ut odio cras mi pede,112
147,5/6/2022,adipiscing lorem vitae mattis nibh ligula nec sem duis aliquam convallis,18
148,7/7/2022,vel lectus in quam fringilla rhoncus mauris enim leo rhoncus sed vestibulum sit amet cursus,166
149,7/6/2022,ligula sit amet eleifend pede libero quis orci nullam molestie,93
150,5/3/2022,curae donec pharetra magna vestibulum aliquet ultrices erat tortor sollicitudin mi sit amet lobortis sapien sapien non mi integer,16
151,7/8/2022,vestibulum vestibulum ante ipsum primis in faucibus orci luctus et ultrices posuere cubilia curae nulla dapibus dolor,102
152,3/6/2022,nulla neque libero convallis eget eleifend luctus ultricies eu nibh quisque id,126
153,1/6/2023,id justo sit amet sapien dignissim vestibulum vestibulum,194
154,9/14/2022,ornare consequat lectus in,160
155,4/28/2022,lorem ipsum dolor sit amet consectetuer adipiscing elit proin interdum mauris non ligula pellentesque ultrices phasellus id sapien,112
156,1/6/2023,porttitor lorem id ligula suspendisse ornare consequat lectus in est risus auctor sed tristique in tempus sit amet sem fusce,43
157,7/27/2022,sapien in sapien iaculis congue,98
158,3/22/2022,volutpat sapien arcu sed augue aliquam erat volutpat in congue etiam,65
159,5/7/2022,ligula pellentesque ultrices phasellus id sapien in sapien iaculis congue vivamus metus arcu adipiscing molestie hendrerit at vulputate,40
160,8/5/2022,blandit lacinia erat vestibulum sed magna at nunc commodo placerat praesent,80
161,12/26/2022,blandit lacinia erat vestibulum sed magna at nunc commodo placerat praesent blandit nam,67
162,9/8/2022,posuere cubilia curae mauris viverra diam vitae quam suspendisse potenti nullam porttitor lacus at turpis donec posuere metus vitae,110
163,5/16/2022,eu sapien cursus vestibulum proin eu mi nulla ac enim,191
164,4/8/2022,justo in hac habitasse,47
165,2/3/2022,rutrum neque aenean auctor gravida sem,33
166,8/4/2022,lacus at velit vivamus vel nulla eget eros,153
167,10/6/2022,curae mauris viverra diam vitae quam suspendisse,21
168,11/22/2022,maecenas pulvinar lobortis est phasellus sit amet erat nulla tempus vivamus in felis eu sapien cursus,60
169,5/12/2022,risus dapibus augue vel accumsan tellus nisi eu,66
170,7/23/2022,ac neque duis bibendum morbi non quam nec dui,106
171,1/14/2023,fermentum donec ut mauris eget massa tempor convallis nulla neque libero convallis eget eleifend luctus ultricies eu nibh,191
172,7/27/2022,in sagittis dui vel,59
173,4/17/2022,justo nec condimentum neque sapien placerat ante nulla justo aliquam quis turpis eget,51
174,11/26/2022,ultrices posuere cubilia curae duis faucibus accumsan odio,47
175,6/18/2022,duis mattis egestas metus aenean fermentum donec,194
176,2/16/2022,sodales sed tincidunt eu felis fusce posuere felis sed,90
177,3/13/2022,mollis molestie lorem quisque ut erat curabitur gravida nisi at nibh in hac,68
178,11/21/2022,sem mauris laoreet ut rhoncus,48
179,4/27/2022,quisque erat eros viverra eget congue eget,147
180,7/28/2022,amet eros suspendisse accumsan tortor quis turpis sed ante vivamus tortor duis mattis egestas metus aenean,12
181,12/4/2022,praesent id massa id nisl venenatis lacinia aenean sit amet justo morbi ut odio cras mi pede malesuada in,83
182,4/19/2022,in hac habitasse platea dictumst aliquam augue quam sollicitudin vitae consectetuer eget rutrum at lorem integer,184
183,7/13/2022,augue vel accumsan tellus nisi eu orci mauris lacinia sapien quis libero nullam sit amet turpis elementum ligula,2
184,12/13/2022,leo odio porttitor id consequat in consequat ut nulla sed accumsan felis ut at dolor quis odio consequat,47
185,5/19/2022,fringilla rhoncus mauris enim leo rhoncus sed,66
186,4/21/2022,arcu libero rutrum ac lobortis vel,133
187,7/24/2022,a suscipit nulla elit ac nulla sed vel,9
188,9/14/2022,posuere cubilia curae nulla dapibus dolor vel est donec odio,10
189,11/19/2022,amet diam in magna bibendum imperdiet nullam orci pede venenatis non,1
190,4/27/2022,lectus in quam fringilla rhoncus mauris enim,170
191,9/19/2022,sit amet diam in magna bibendum imperdiet nullam,62
192,10/14/2022,in magna bibendum imperdiet nullam orci pede venenatis non sodales sed tincidunt eu felis fusce posuere felis sed lacus,194
193,8/20/2022,curabitur convallis duis consequat dui nec nisi volutpat eleifend donec ut dolor morbi,170
194,6/21/2022,massa quis augue luctus tincidunt,132
195,6/26/2022,volutpat sapien arcu sed augue aliquam erat volutpat in congue etiam justo,188
196,11/19/2022,eget vulputate ut ultrices vel augue vestibulum ante ipsum primis in faucibus orci luctus et ultrices posuere,81
197,5/14/2022,id luctus nec molestie sed justo pellentesque viverra pede ac diam cras pellentesque volutpat dui,66
198,11/18/2022,nibh in hac habitasse platea dictumst aliquam augue quam sollicitudin vitae consectetuer eget,110
199,10/9/2022,diam neque vestibulum eget vulputate ut ultrices,78
200,2/28/2022,tellus nisi eu orci mauris lacinia sapien quis libero nullam sit,11
201,6/30/2022,quis turpis sed ante vivamus tortor duis mattis egestas metus aenean fermentum donec ut mauris,139
202,7/27/2022,turpis eget elit sodales scelerisque mauris sit amet eros suspendisse,158
203,2/28/2022,lacus purus aliquet at feugiat non,95
204,2/11/2022,donec posuere metus vitae ipsum aliquam non mauris morbi non,43
205,7/21/2022,risus auctor sed tristique in,98
206,8/25/2022,ac nulla sed vel enim sit amet nunc viverra dapibus nulla suscipit,35
207,4/24/2022,congue risus semper porta volutpat quam pede lobortis ligula sit amet eleifend pede libero quis orci nullam molestie,7
208,3/27/2022,non pretium quis lectus suspendisse potenti in eleifend quam a odio,42
209,2/26/2022,vivamus metus arcu adipiscing molestie hendrerit,198
210,3/24/2022,congue risus semper porta volutpat quam pede lobortis,113
211,6/26/2022,sagittis nam congue risus semper,125
212,2/10/2022,magna bibendum imperdiet nullam orci pede venenatis non sodales sed tincidunt eu felis fusce posuere felis sed lacus morbi sem,39
213,12/25/2022,imperdiet sapien urna pretium nisl,143
214,7/25/2022,sed ante vivamus tortor duis mattis egestas metus aenean fermentum donec ut mauris eget,32
215,12/9/2022,bibendum felis sed interdum venenatis turpis enim blandit mi in porttitor pede justo eu massa,22
216,7/21/2022,augue vel accumsan tellus nisi eu orci mauris lacinia sapien quis libero,111
217,9/23/2022,felis ut at dolor quis odio consequat varius integer ac leo pellentesque ultrices mattis,137
218,5/22/2022,eu felis fusce posuere felis sed,110
219,2/23/2022,ut rhoncus aliquet pulvinar sed nisl nunc rhoncus dui vel sem sed,5
220,10/9/2022,tempus sit amet sem fusce consequat nulla nisl nunc nisl duis bibendum felis sed interdum venenatis,159
221,5/10/2022,sit amet consectetuer adipiscing elit proin risus,70
222,11/11/2022,morbi non lectus aliquam sit amet diam in magna bibendum imperdiet nullam orci pede venenatis non sodales sed tincidunt,93
223,5/11/2022,mi in porttitor pede justo eu,153
224,8/24/2022,aliquam convallis nunc proin at turpis a pede posuere nonummy integer,46
225,9/7/2022,tempus vel pede morbi porttitor lorem,131
226,8/14/2022,curae mauris viverra diam vitae,111
227,1/4/2023,nulla ut erat id mauris vulputate elementum nullam varius nulla facilisi cras non velit nec nisi vulputate nonummy,63
228,11/22/2022,sapien cursus vestibulum proin eu mi nulla ac enim in tempor turpis nec euismod scelerisque quam,190
229,5/17/2022,semper sapien a libero nam dui proin leo odio porttitor id consequat in consequat ut nulla sed,46
230,11/1/2022,integer ac neque duis bibendum morbi non quam nec,46
231,11/10/2022,mattis odio donec vitae nisi nam ultrices libero non mattis,110
232,9/5/2022,pellentesque at nulla suspendisse,164
233,11/11/2022,vestibulum ante ipsum primis in faucibus,115
234,6/24/2022,turpis donec posuere metus vitae ipsum aliquam non mauris morbi non lectus aliquam,161
235,1/8/2023,eget massa tempor convallis nulla neque libero convallis eget eleifend luctus,113
236,8/19/2022,penatibus et magnis dis parturient montes nascetur ridiculus,131
237,1/19/2023,tempor convallis nulla neque,125
238,6/14/2022,dapibus dolor vel est donec odio,183
239,8/9/2022,massa id nisl venenatis lacinia aenean sit amet justo morbi ut odio cras mi pede malesuada in imperdiet et,106
240,11/30/2022,diam erat fermentum justo nec condimentum,137
241,1/17/2023,pellentesque viverra pede ac diam cras,187
242,12/5/2022,erat tortor sollicitudin mi sit amet lobortis sapien sapien non mi integer ac neque duis bibendum morbi,197
243,11/10/2022,sem sed sagittis nam congue risus semper porta volutpat quam pede lobortis ligula sit amet,127
244,7/16/2022,orci luctus et ultrices posuere cubilia curae mauris viverra diam vitae quam suspendisse potenti nullam porttitor,180
245,1/7/2023,diam neque vestibulum eget vulputate,101
246,4/21/2022,luctus nec molestie sed justo pellentesque viverra pede ac diam cras pellentesque volutpat dui maecenas tristique est,193
247,1/18/2023,amet consectetuer adipiscing elit proin risus praesent lectus vestibulum quam sapien varius ut blandit non,141
248,2/17/2022,accumsan tortor quis turpis sed ante vivamus tortor,60
249,3/5/2022,orci pede venenatis non sodales sed tincidunt eu felis fusce posuere felis sed lacus morbi sem mauris laoreet,197
250,4/24/2022,aenean fermentum donec ut,8
251,3/1/2022,fermentum donec ut mauris eget massa tempor,126
252,1/17/2023,nibh in quis justo maecenas rhoncus aliquam lacus morbi quis tortor id,170
253,4/6/2022,ornare imperdiet sapien urna pretium nisl ut volutpat sapien arcu sed augue,23
254,11/11/2022,risus auctor sed tristique in tempus sit amet sem fusce consequat nulla nisl nunc nisl duis bibendum felis sed interdum,9
255,1/19/2023,nam congue risus semper porta volutpat quam pede lobortis ligula sit amet eleifend pede libero quis orci nullam molestie nibh,187
256,4/10/2022,vestibulum quam sapien varius ut blandit non interdum in ante vestibulum ante,186
257,6/8/2022,eget eleifend luctus ultricies eu nibh quisque id justo sit amet sapien dignissim vestibulum vestibulum ante ipsum primis in,84
258,2/10/2022,ligula nec sem duis aliquam convallis nunc proin at turpis a pede posuere nonummy integer non velit donec diam neque,143
259,2/16/2022,donec semper sapien a libero nam dui proin,68
260,4/12/2022,congue eget semper rutrum nulla nunc purus phasellus,116
261,7/7/2022,dui luctus rutrum nulla tellus in sagittis dui vel,150
262,9/29/2022,accumsan tortor quis turpis sed ante vivamus tortor duis mattis egestas metus aenean fermentum donec ut,7
263,12/25/2022,quam suspendisse potenti nullam porttitor lacus,34
264,7/10/2022,vitae nisl aenean lectus pellentesque eget nunc donec quis orci eget orci vehicula condimentum curabitur in libero ut massa,151
265,12/3/2022,eu sapien cursus vestibulum,77
266,10/30/2022,erat quisque erat eros viverra eget congue eget semper rutrum nulla nunc purus phasellus in felis donec semper sapien,193
267,3/1/2022,vestibulum quam sapien varius ut blandit non interdum in ante vestibulum ante ipsum primis,101
268,1/23/2023,sit amet consectetuer adipiscing elit proin risus praesent lectus vestibulum quam sapien varius ut blandit non,33
269,10/2/2022,pulvinar sed nisl nunc rhoncus dui vel,37
270,8/1/2022,lacus purus aliquet at feugiat non pretium quis lectus suspendisse potenti in eleifend quam,10
271,1/23/2023,mattis odio donec vitae nisi nam ultrices libero,21
272,1/19/2023,risus auctor sed tristique in tempus sit amet sem fusce consequat nulla nisl nunc nisl duis bibendum,102
273,1/17/2023,odio elementum eu interdum eu tincidunt in leo maecenas pulvinar,160
274,11/7/2022,fusce posuere felis sed lacus morbi sem mauris laoreet ut rhoncus aliquet pulvinar sed nisl nunc rhoncus dui vel sem,47
275,12/22/2022,eu orci mauris lacinia,99
276,12/13/2022,sollicitudin mi sit amet lobortis sapien sapien non mi integer ac neque duis bibendum morbi non quam nec dui,102
277,7/4/2022,convallis nunc proin at turpis a pede posuere nonummy integer,200
278,8/25/2022,integer non velit donec diam neque vestibulum eget vulputate ut ultrices vel augue vestibulum ante ipsum primis in,63
279,1/12/2023,suspendisse potenti in eleifend quam,76
280,4/22/2022,sem praesent id massa id nisl venenatis lacinia aenean sit amet,9
281,4/7/2022,a ipsum integer a nibh in quis justo maecenas rhoncus aliquam lacus morbi,82
