id,createdAt,content,authorId
557,4/19/2022,non mattis pulvinar nulla pede ullamcorper augue a suscipit nulla elit ac,110
558,5/31/2022,arcu adipiscing molestie hendrerit at vulputate vitae nisl aenean lectus pellentesque eget nunc donec,35
559,4/7/2022,potenti nullam porttitor lacus at turpis donec posuere,36
560,7/8/2022,in porttitor pede justo eu massa,62
561,11/30/2022,elit sodales scelerisque mauris sit amet eros suspendisse accumsan tortor quis turpis sed ante vivamus tortor duis mattis,112
562,9/20/2022,vulputate luctus cum sociis natoque penatibus et magnis dis parturient montes nascetur ridiculus mus vivamus vestibulum sagittis,166
563,8/5/2022,elit ac nulla sed vel enim sit amet nunc,86
564,5/1/2022,morbi ut odio cras mi pede malesuada,69
565,10/16/2022,orci eget orci vehicula condimentum curabitur in libero ut massa volutpat convallis morbi odio odio elementum eu interdum eu tincidunt,104
566,12/20/2022,in felis eu sapien cursus vestibulum proin eu mi nulla ac enim in,198
567,12/29/2022,nec euismod scelerisque quam turpis adipiscing lorem vitae mattis nibh ligula nec sem duis aliquam convallis nunc,9
568,9/18/2022,nulla integer pede justo lacinia,192
569,7/20/2022,imperdiet sapien urna pretium nisl ut volutpat sapien arcu sed,21
570,9/22/2022,nisl aenean lectus pellentesque eget nunc donec quis orci eget orci vehicula condimentum curabitur in libero ut massa volutpat,31
571,7/13/2022,sapien varius ut blandit non interdum in ante,198
572,10/14/2022,nunc vestibulum ante ipsum primis in faucibus orci,129
573,3/9/2022,vestibulum vestibulum ante ipsum primis in faucibus,160
574,12/22/2022,etiam pretium iaculis justo in,200
575,2/24/2022,velit donec diam neque vestibulum eget vulputate ut ultrices vel augue vestibulum ante ipsum primis in faucibus orci luctus,37
576,2/28/2022,quam sollicitudin vitae consectetuer eget rutrum at lorem integer tincidunt ante vel ipsum praesent blandit lacinia,59
577,11/28/2022,vestibulum velit id pretium iaculis diam erat fermentum justo nec,117
578,8/11/2022,at turpis a pede posuere nonummy,163
579,2/22/2022,quam fringilla rhoncus mauris enim leo rhoncus sed,187
580,7/8/2022,dolor sit amet consectetuer adipiscing,128
581,1/29/2022,justo aliquam quis turpis eget elit sodales scelerisque mauris sit amet eros suspendisse accumsan tortor quis turpis sed,83
582,3/4/2022,imperdiet nullam orci pede venenatis non sodales sed tincidunt eu felis,80
583,5/16/2022,vitae nisl aenean lectus pellentesque eget nunc donec,171
584,11/13/2022,orci nullam molestie nibh in lectus pellentesque at nulla suspendisse potenti cras in purus eu magna vulputate,197
585,7/6/2022,ipsum primis in faucibus orci luctus et,1
586,7/27/2022,morbi sem mauris laoreet ut rhoncus aliquet pulvinar sed,44
587,11/20/2022,non pretium quis lectus suspendisse potenti in eleifend quam a odio in hac habitasse platea,141
588,12/15/2022,nunc rhoncus dui vel sem,200
589,1/12/2023,ante ipsum primis in faucibus orci luctus et ultrices posuere cubilia,3
590,1/5/2023,turpis sed ante vivamus tortor duis mattis egestas metus aenean fermentum,60
591,3/18/2022,morbi quis tortor id nulla ultrices aliquet maecenas leo odio condimentum id luctus nec,75
592,12/27/2022,leo pellentesque ultrices mattis odio donec vitae nisi nam ultrices libero non mattis pulvinar,106
593,8/9/2022,eros viverra eget congue eget semper rutrum nulla nunc purus phasellus in felis donec semper sapien a libero nam,93
594,6/18/2022,enim in tempor turpis nec,1
595,4/21/2022,integer ac neque duis bibendum morbi non quam nec dui luctus rutrum nulla tellus in sagittis dui vel nisl duis,79
596,2/17/2022,bibendum felis sed interdum venenatis turpis enim,2
597,9/12/2022,augue vestibulum rutrum rutrum neque aenean auctor gravida sem praesent id massa,176
598,4/28/2022,elementum pellentesque quisque porta volutpat,92
599,12/27/2022,congue elementum in hac,137
600,10/11/2022,ut erat id mauris vulputate elementum nullam varius nulla facilisi cras non velit nec nisi vulputate nonummy maecenas tincidunt,22
601,10/3/2022,nulla neque libero convallis eget eleifend luctus ultricies eu nibh quisque id justo sit amet sapien,65
602,6/3/2022,id ornare imperdiet sapien urna pretium nisl ut volutpat sapien arcu sed augue aliquam erat,134
603,7/9/2022,parturient montes nascetur ridiculus mus etiam vel augue vestibulum rutrum rutrum neque aenean auctor gravida sem praesent id massa,174
604,8/18/2022,orci luctus et ultrices posuere cubilia curae duis faucibus,93
605,5/2/2022,est congue elementum in,41
606,5/26/2022,imperdiet sapien urna pretium,65
607,12/31/2022,blandit mi in porttitor pede justo eu massa donec,33
608,8/24/2022,consequat nulla nisl nunc nisl duis bibendum felis sed interdum,87
609,9/3/2022,non velit donec diam neque vestibulum eget vulputate ut ultrices vel augue vestibulum ante ipsum primis in faucibus orci luctus,71
610,12/26/2022,nunc purus phasellus in felis donec semper sapien a libero nam dui proin leo odio,84
611,4/17/2022,mattis odio donec vitae nisi nam ultrices libero non,178
612,4/28/2022,vitae quam suspendisse potenti nullam porttitor,13
613,11/16/2022,sagittis sapien cum sociis natoque penatibus et magnis dis parturient montes nascetur,199
614,2/23/2022,morbi porttitor lorem id ligula suspendisse ornare consequat lectus in est,96
615,7/23/2022,ut suscipit a feugiat et eros vestibulum ac est lacinia nisi venenatis tristique fusce congue diam id ornare imperdiet sapien,70
616,6/9/2022,accumsan tortor quis turpis sed ante vivamus tortor duis mattis,73
617,4/21/2022,amet diam in magna bibendum imperdiet nullam orci pede venenatis non sodales sed tincidunt eu felis fusce posuere felis sed,133
618,7/11/2022,primis in faucibus orci luctus et ultrices posuere,100
619,5/15/2022,bibendum morbi non quam nec dui luctus rutrum nulla tellus in sagittis dui vel nisl duis ac nibh,44
620,11/8/2022,vel enim sit amet nunc viverra dapibus nulla suscipit ligula in lacus curabitur at ipsum ac,3
621,9/10/2022,quisque porta volutpat erat quisque erat eros viverra eget congue eget,187
622,9/21/2022,velit eu est congue elementum in,65
623,4/18/2022,parturient montes nascetur ridiculus mus vivamus vestibulum sagittis sapien cum sociis natoque penatibus,180
624,2/20/2022,phasellus sit amet erat nulla,73
625,7/5/2022,curae donec pharetra magna vestibulum aliquet ultrices erat tortor,160
626,1/9/2023,ut erat curabitur gravida nisi at nibh in hac habitasse platea dictumst aliquam augue quam sollicitudin vitae consectetuer eget,170
627,9/8/2022,nulla tempus vivamus in felis eu sapien cursus vestibulum proin eu mi nulla ac enim in tempor turpis nec,140
628,1/20/2023,eros viverra eget congue eget semper rutrum nulla nunc purus phasellus in felis donec semper sapien a libero,123
629,8/28/2022,tincidunt nulla mollis molestie lorem quisque ut erat curabitur gravida nisi at nibh in hac,42
630,11/14/2022,est lacinia nisi venenatis tristique fusce congue diam id ornare imperdiet sapien urna pretium nisl ut volutpat,63
631,1/29/2022,nulla pede ullamcorper augue a suscipit nulla elit ac,90
632,11/28/2022,cubilia curae mauris viverra diam vitae,67
633,5/5/2022,eu nibh quisque id justo sit amet sapien,85
634,9/11/2022,ac consequat metus sapien ut,54
635,3/9/2022,nec nisi volutpat eleifend donec ut dolor morbi vel lectus in quam fringilla rhoncus mauris enim leo,112
636,4/19/2022,in imperdiet et commodo vulputate justo in blandit ultrices enim,44
637,10/6/2022,ridiculus mus vivamus vestibulum sagittis sapien,16
638,3/16/2022,duis ac nibh fusce lacus purus aliquet at feugiat non pretium quis lectus suspendisse potenti in eleifend,107
639,3/19/2022,ultrices enim lorem ipsum dolor sit amet consectetuer adipiscing elit proin interdum mauris non ligula pellentesque,64
640,8/16/2022,vestibulum aliquet ultrices erat tortor sollicitudin mi sit amet lobortis sapien sapien non mi integer ac neque duis bibendum morbi,47
641,2/15/2022,pede morbi porttitor lorem id ligula suspendisse ornare consequat,98
642,8/1/2022,sem duis aliquam convallis nunc proin at turpis a pede posuere nonummy,170
643,8/3/2022,eu nibh quisque id justo sit amet sapien dignissim vestibulum vestibulum ante ipsum,104
644,11/18/2022,ultricies eu nibh quisque id justo sit amet sapien dignissim vestibulum vestibulum ante ipsum,192
645,9/3/2022,eu magna vulputate luctus cum sociis natoque penatibus et magnis,110
646,9/8/2022,ultrices enim lorem ipsum dolor sit amet consectetuer adipiscing elit proin interdum,87
647,3/15/2022,duis aliquam convallis nunc proin at turpis a pede posuere nonummy integer non velit donec diam neque,1
648,7/26/2022,nullam porttitor lacus at turpis donec posuere metus vitae ipsum aliquam non mauris,46
649,12/5/2022,fusce consequat nulla nisl nunc nisl duis bibendum felis sed interdum venenatis turpis,94
650,10/7/2022,lacinia erat vestibulum sed magna,185
651,12/9/2022,natoque penatibus et magnis dis parturient montes nascetur ridiculus mus,19
652,9/30/2022,at ipsum ac tellus semper interdum mauris ullamcorper purus sit amet nulla quisque,105
653,10/22/2022,dapibus duis at velit eu est congue elementum in,48
654,3/30/2022,augue luctus tincidunt nulla mollis molestie lorem quisque ut erat curabitur gravida nisi at nibh in hac habitasse platea dictumst,72
655,1/22/2023,velit eu est congue elementum,153
656,12/7/2022,tristique in tempus sit amet sem fusce consequat nulla nisl nunc nisl duis bibendum felis sed interdum,169
657,4/3/2022,quis augue luctus tincidunt nulla mollis molestie lorem quisque ut erat curabitur gravida nisi at,145
658,2/20/2022,posuere metus vitae ipsum aliquam non,166
659,1/1/2023,volutpat convallis morbi odio odio elementum eu interdum eu tincidunt in leo maecenas pulvinar lobortis est phasellus sit amet erat,54
660,3/19/2022,nisi volutpat eleifend donec ut dolor morbi vel lectus in quam fringilla rhoncus mauris enim leo rhoncus sed,15
661,11/11/2022,iaculis congue vivamus metus arcu adipiscing molestie hendrerit at vulputate vitae nisl aenean lectus pellentesque,185
662,7/29/2022,convallis duis consequat dui nec nisi volutpat eleifend donec ut dolor morbi,121
663,10/22/2022,vestibulum velit id pretium iaculis diam,85
664,5/21/2022,faucibus orci luctus et ultrices posuere cubilia curae mauris viverra diam vitae quam suspendisse potenti,82
665,11/24/2022,interdum mauris non ligula pellentesque ultrices phasellus id sapien in sapien iaculis congue,113
666,10/11/2022,ante ipsum primis in faucibus orci luctus et ultrices posuere cubilia curae duis faucibus accumsan odio,165
667,10/10/2022,venenatis turpis enim blandit mi,146
668,10/4/2022,augue luctus tincidunt nulla mollis molestie lorem quisque ut erat curabitur gravida nisi,114
669,6/15/2022,varius integer ac leo pellentesque ultrices,43
670,9/16/2022,augue vestibulum rutrum rutrum neque aenean auctor gravida sem,73
671,12/11/2022,sed lacus morbi sem mauris laoreet ut rhoncus aliquet pulvinar sed nisl nunc rhoncus dui vel,149
672,2/28/2022,porttitor pede justo eu massa donec dapibus duis at velit eu est congue elementum in hac habitasse platea,172
673,5/28/2022,lectus pellentesque at nulla suspendisse potenti cras in purus eu magna vulputate luctus cum,46
674,2/27/2022,eget vulputate ut ultrices vel augue vestibulum ante ipsum primis,154
675,7/9/2022,enim sit amet nunc viverra dapibus nulla suscipit ligula in lacus curabitur at,91
676,11/5/2022,libero quis orci nullam molestie nibh in lectus pellentesque at nulla suspendisse potenti cras in purus eu magna vulputate luctus,140
677,7/7/2022,fusce consequat nulla nisl nunc nisl duis bibendum felis sed interdum venenatis turpis enim blandit mi in porttitor pede,75
678,11/6/2022,leo pellentesque ultrices mattis odio donec vitae nisi nam ultrices libero non mattis pulvinar,14
679,11/12/2022,vestibulum velit id pretium iaculis diam erat fermentum justo nec condimentum neque,25
680,8/16/2022,blandit ultrices enim lorem ipsum dolor sit,27
681,1/15/2023,id ornare imperdiet sapien urna pretium nisl ut volutpat,184
682,1/23/2023,consectetuer eget rutrum at lorem integer tincidunt ante vel ipsum praesent blandit lacinia erat,176
683,9/10/2022,sed tristique in tempus sit amet sem fusce consequat nulla nisl nunc nisl duis bibendum felis sed interdum venenatis,24
684,10/7/2022,quam nec dui luctus rutrum nulla tellus in sagittis dui vel nisl duis ac nibh fusce lacus,141
685,3/30/2022,eu interdum eu tincidunt in,69
686,1/8/2023,pulvinar lobortis est phasellus sit amet erat nulla tempus,31
687,5/15/2022,rhoncus sed vestibulum sit amet cursus id turpis integer aliquet massa id lobortis convallis,139
688,9/9/2022,duis consequat dui nec nisi volutpat eleifend donec ut dolor morbi vel lectus,108
689,7/14/2022,vulputate ut ultrices vel augue vestibulum ante ipsum primis,151
690,7/30/2022,nunc nisl duis bibendum felis sed interdum venenatis turpis,110
691,9/30/2022,donec posuere metus vitae ipsum aliquam non mauris morbi non lectus aliquam sit amet diam in magna bibendum imperdiet,26
692,3/10/2022,ante vel ipsum praesent blandit lacinia erat vestibulum sed magna at nunc commodo placerat praesent blandit nam nulla integer pede,154
693,7/23/2022,posuere nonummy integer non velit donec diam neque vestibulum eget vulputate,28
694,10/22/2022,curae donec pharetra magna vestibulum,198
695,7/7/2022,pretium nisl ut volutpat sapien arcu sed augue aliquam erat volutpat,133
696,2/20/2022,ac lobortis vel dapibus at diam nam tristique tortor eu,144
697,5/30/2022,est et tempus semper est quam pharetra magna ac,36
698,6/2/2022,vehicula condimentum curabitur in libero ut massa volutpat convallis morbi odio odio elementum eu interdum eu,34
699,4/24/2022,non mi integer ac,133
700,9/27/2022,consectetuer adipiscing elit proin risus praesent lectus vestibulum quam sapien,51
701,10/5/2022,pede ac diam cras pellentesque volutpat dui maecenas tristique est et tempus semper est quam pharetra magna ac consequat,147
702,8/20/2022,amet justo morbi ut odio cras,89
703,4/5/2022,odio elementum eu interdum,188
704,6/5/2022,dictumst morbi vestibulum velit id pretium iaculis diam erat fermentum justo nec,64
705,12/22/2022,a ipsum integer a nibh in quis justo maecenas rhoncus aliquam lacus morbi quis tortor id nulla ultrices aliquet,175
706,3/24/2022,lacinia eget tincidunt eget tempus vel pede morbi porttitor lorem id ligula suspendisse ornare consequat lectus,17
707,5/23/2022,a odio in hac,167
708,12/12/2022,proin eu mi nulla ac enim in tempor turpis,97
709,9/22/2022,massa donec dapibus duis at velit eu,139
710,3/24/2022,nulla nisl nunc nisl duis bibendum felis,164
711,1/19/2023,nibh in quis justo maecenas rhoncus aliquam lacus morbi quis tortor id nulla ultrices aliquet,136
712,11/4/2022,vulputate justo in blandit ultrices enim lorem ipsum dolor sit amet consectetuer adipiscing elit proin,23
713,3/17/2022,tempor convallis nulla neque libero convallis eget eleifend luctus ultricies eu nibh quisque id justo sit amet sapien dignissim vestibulum,4
714,10/27/2022,sodales sed tincidunt eu felis fusce,112
715,7/2/2022,libero rutrum ac lobortis vel dapibus at diam nam tristique tortor eu pede,40
716,8/15/2022,tortor id nulla ultrices aliquet maecenas leo odio condimentum id luctus nec molestie sed justo pellentesque,183
717,5/31/2022,aliquet ultrices erat tortor sollicitudin mi sit amet lobortis sapien sapien non,151
718,5/7/2022,blandit nam nulla integer pede justo lacinia eget tincidunt eget tempus vel pede,167
719,9/29/2022,gravida nisi at nibh in hac habitasse platea dictumst aliquam augue quam,151
720,8/4/2022,ut mauris eget massa tempor convallis nulla neque libero convallis eget eleifend luctus,77
721,11/30/2022,integer tincidunt ante vel ipsum praesent blandit lacinia erat vestibulum sed,43
722,9/12/2022,commodo placerat praesent blandit nam nulla integer pede justo lacinia eget tincidunt eget tempus vel pede morbi porttitor lorem id,44
723,7/25/2022,aliquam lacus morbi quis,73
724,11/27/2022,lectus in est risus auctor sed tristique in tempus sit amet sem fusce,66
725,6/27/2022,pede posuere nonummy integer non velit donec diam neque vestibulum eget vulputate ut ultrices vel augue vestibulum ante ipsum,149
726,12/11/2022,tellus semper interdum mauris ullamcorper purus sit,62
727,11/23/2022,viverra eget congue eget semper rutrum nulla nunc purus,16
728,12/2/2022,cras non velit nec nisi vulputate,155
729,3/5/2022,tempor turpis nec euismod scelerisque quam turpis adipiscing lorem vitae mattis nibh ligula,31
730,7/17/2022,at nunc commodo placerat praesent blandit nam nulla integer pede justo lacinia eget tincidunt eget tempus vel pede,96
731,6/5/2022,eget rutrum at lorem integer tincidunt ante vel ipsum praesent blandit lacinia erat vestibulum,6
732,8/16/2022,sem sed sagittis nam congue risus semper porta volutpat quam pede lobortis ligula sit amet eleifend,172
733,10/25/2022,tellus nisi eu orci mauris lacinia sapien quis libero,114
734,8/7/2022,vel enim sit amet nunc viverra,121
735,2/13/2022,ut nunc vestibulum ante ipsum primis in faucibus,181
736,1/14/2023,porttitor lorem id ligula suspendisse,148
737,11/11/2022,rhoncus mauris enim leo rhoncus sed vestibulum sit amet cursus id turpis integer aliquet massa id lobortis,125
738,5/7/2022,neque duis bibendum morbi non quam nec dui luctus rutrum nulla tellus in sagittis dui vel nisl duis ac,170
739,10/6/2022,sit amet nunc viverra dapibus nulla suscipit ligula in lacus curabitur at ipsum ac tellus semper interdum mauris,21
740,12/21/2022,aenean lectus pellentesque eget nunc donec quis orci eget orci vehicula condimentum curabitur,186
741,1/23/2023,purus aliquet at feugiat non pretium quis lectus,118
742,5/7/2022,ullamcorper purus sit amet nulla quisque arcu libero rutrum ac lobortis,107
743,12/10/2022,convallis tortor risus dapibus augue vel accumsan tellus nisi eu orci mauris lacinia sapien quis libero nullam sit,58
744,4/25/2022,in faucibus orci luctus et,97
745,8/26/2022,morbi non quam nec dui luctus rutrum nulla tellus in sagittis dui vel nisl,167
746,12/25/2022,felis sed lacus morbi sem mauris laoreet ut rhoncus aliquet pulvinar sed,163
747,12/2/2022,aenean sit amet justo morbi ut odio cras mi,165
748,7/19/2022,sollicitudin vitae consectetuer eget rutrum at lorem integer tincidunt ante,155
749,8/16/2022,amet consectetuer adipiscing elit proin risus praesent lectus vestibulum quam sapien varius ut,184
750,3/27/2022,ut erat id mauris vulputate elementum,45
751,5/15/2022,est lacinia nisi venenatis tristique fusce congue,181
752,11/6/2022,ut erat curabitur gravida nisi at nibh in hac habitasse platea,119
753,8/3/2022,quam sapien varius ut blandit non interdum in ante vestibulum ante ipsum primis in faucibus,104
754,10/23/2022,in tempus sit amet sem fusce consequat nulla nisl nunc nisl,68
755,2/12/2022,congue vivamus metus arcu adipiscing molestie hendrerit at vulputate vitae nisl aenean lectus pellentesque eget nunc donec,53
756,3/22/2022,ac lobortis vel dapibus at diam nam tristique tortor eu,130
757,7/7/2022,vestibulum velit id pretium iaculis diam erat fermentum,42
758,4/3/2022,vestibulum velit id pretium iaculis diam erat fermentum justo,136
759,7/23/2022,sed sagittis nam congue risus semper porta volutpat quam pede lobortis ligula sit amet,66
760,5/6/2022,nisl duis bibendum felis sed interdum venenatis turpis,43
761,3/29/2022,aliquet ultrices erat tortor sollicitudin mi sit,101
762,9/29/2022,at vulputate vitae nisl,123
763,11/13/2022,ac leo pellentesque ultrices mattis odio donec vitae nisi nam ultrices,47
764,9/7/2022,blandit ultrices enim lorem ipsum dolor sit amet consectetuer adipiscing elit proin interdum mauris non ligula pellentesque,199
765,4/8/2022,dis parturient montes nascetur ridiculus mus etiam vel augue vestibulum,87
766,2/21/2022,luctus et ultrices posuere cubilia,154
767,12/1/2022,magna bibendum imperdiet nullam orci pede venenatis non sodales sed tincidunt eu felis fusce posuere felis sed lacus,141
768,1/27/2022,ut dolor morbi vel lectus in quam fringilla rhoncus mauris enim leo rhoncus sed vestibulum sit amet cursus,155
769,2/15/2022,ipsum primis in faucibus orci luctus et ultrices posuere cubilia curae nulla dapibus dolor vel est donec,187
770,10/1/2022,vestibulum eget vulputate ut ultrices vel augue vestibulum ante ipsum primis in faucibus orci luctus,16
771,7/6/2022,felis fusce posuere felis sed lacus morbi sem mauris,173
772,3/8/2022,pellentesque ultrices phasellus id sapien in sapien iaculis congue vivamus metus arcu adipiscing molestie hendrerit at vulputate vitae nisl aenean,159
773,4/27/2022,massa quis augue luctus tincidunt nulla mollis molestie lorem quisque ut erat curabitur gravida nisi at nibh in,199
774,7/28/2022,morbi quis tortor id nulla ultrices aliquet maecenas leo odio condimentum id luctus nec molestie sed justo pellentesque,109
775,6/22/2022,donec odio justo sollicitudin,32
776,9/18/2022,tellus nisi eu orci mauris lacinia sapien quis libero nullam,71
777,3/28/2022,habitasse platea dictumst aliquam augue quam sollicitudin vitae consectetuer,94
778,1/7/2023,blandit nam nulla integer pede justo lacinia eget tincidunt eget tempus,137
779,8/6/2022,in quis justo maecenas rhoncus aliquam lacus,156
780,4/7/2022,ornare consequat lectus in est,151
781,4/22/2022,erat tortor sollicitudin mi sit amet lobortis sapien sapien non mi integer ac neque duis bibendum morbi non quam nec,71
782,4/12/2022,massa quis augue luctus tincidunt nulla mollis molestie lorem,56
783,1/27/2022,velit eu est congue elementum in hac habitasse platea dictumst morbi vestibulum velit id pretium iaculis,42
784,10/12/2022,ut massa quis augue luctus tincidunt nulla,64
785,10/5/2022,morbi vestibulum velit id pretium iaculis diam erat fermentum justo,131
786,3/25/2022,turpis elementum ligula vehicula consequat morbi a ipsum integer a nibh in,65
787,7/8/2022,morbi non lectus aliquam sit amet diam in magna bibendum imperdiet nullam orci,174
788,3/30/2022,eleifend quam a odio in hac,195
789,1/8/2023,fusce posuere felis sed lacus morbi sem mauris laoreet ut rhoncus,53
790,8/6/2022,magnis dis parturient montes nascetur ridiculus mus,184
791,1/22/2023,rutrum nulla nunc purus,79
792,11/10/2022,nulla ac enim in tempor turpis nec euismod scelerisque quam turpis adipiscing lorem vitae,1
793,5/26/2022,sem sed sagittis nam congue risus semper,62
794,3/17/2022,luctus nec molestie sed justo pellentesque viverra pede ac diam cras pellentesque,165
795,5/17/2022,lacus purus aliquet at feugiat non pretium quis lectus suspendisse potenti in,66
796,3/11/2022,lobortis sapien sapien non mi integer ac neque duis,170
797,7/15/2022,sociis natoque penatibus et magnis,82
798,4/24/2022,donec vitae nisi nam ultrices libero non mattis pulvinar nulla pede ullamcorper augue a suscipit,151
799,9/4/2022,turpis a pede posuere nonummy integer non velit donec diam neque vestibulum eget,32
800,7/7/2022,odio odio elementum eu interdum eu tincidunt in leo maecenas pulvinar lobortis est phasellus sit amet erat nulla tempus vivamus,75
801,12/10/2022,amet sapien dignissim vestibulum vestibulum ante ipsum primis in faucibus orci luctus et ultrices posuere cubilia,155
802,2/27/2022,dapibus duis at velit eu est congue elementum in,126
803,8/7/2022,consequat nulla nisl nunc nisl duis bibendum felis sed interdum venenatis,118
804,4/29/2022,amet justo morbi ut,6
805,5/24/2022,in lacus curabitur at ipsum ac tellus semper interdum mauris ullamcorper purus,46
806,8/25/2022,congue vivamus metus arcu adipiscing molestie hendrerit at vulputate vitae nisl aenean lectus pellentesque eget,31
807,4/9/2022,augue vestibulum rutrum rutrum neque aenean auctor gravida sem praesent,89
808,3/14/2022,scelerisque mauris sit amet eros suspendisse accumsan tortor quis,143
809,5/23/2022,in felis donec semper sapien,105
810,12/7/2022,suspendisse accumsan tortor quis turpis sed ante vivamus tortor duis mattis egestas metus aenean fermentum donec ut mauris eget massa,76
811,9/18/2022,mauris viverra diam vitae quam suspendisse potenti,76
812,12/30/2022,sapien sapien non mi integer,160
813,7/2/2022,at diam nam tristique tortor eu,61
814,9/13/2022,donec dapibus duis at velit eu est congue elementum in hac habitasse platea dictumst morbi,19
815,7/7/2022,morbi sem mauris laoreet ut rhoncus aliquet,51
816,1/17/2023,in consequat ut nulla sed accumsan felis ut,132
817,5/28/2022,dui nec nisi volutpat eleifend donec ut dolor morbi vel lectus in quam fringilla rhoncus,60
818,8/10/2022,integer aliquet massa id lobortis convallis tortor risus dapibus augue vel,136
819,9/17/2022,ultrices vel augue vestibulum ante ipsum primis in faucibus orci luctus et ultrices,97
820,8/23/2022,nam ultrices libero non mattis pulvinar nulla pede ullamcorper augue a suscipit,52
821,4/30/2022,orci vehicula condimentum curabitur in,122
822,5/29/2022,odio in hac habitasse platea dictumst maecenas ut massa quis augue,62
823,6/18/2022,velit eu est congue elementum in hac habitasse platea dictumst,83
824,1/1/2023,aenean fermentum donec ut mauris eget massa tempor convallis nulla neque libero convallis eget eleifend luctus ultricies eu nibh,182
825,5/17/2022,mattis egestas metus aenean fermentum donec ut mauris eget massa tempor convallis nulla neque,157
826,12/17/2022,varius nulla facilisi cras non velit nec nisi vulputate,91
827,12/25/2022,aliquam non mauris morbi non lectus aliquam sit amet diam in magna bibendum imperdiet nullam orci pede venenatis,123
828,1/11/2023,mauris ullamcorper purus sit amet nulla quisque arcu libero rutrum,77
829,3/25/2022,tristique fusce congue diam id ornare imperdiet sapien urna pretium nisl ut volutpat sapien arcu sed augue aliquam erat volutpat,28
830,1/16/2023,id massa id nisl venenatis lacinia aenean sit amet justo morbi ut odio cras,154
831,12/17/2022,integer ac neque duis bibendum morbi non,172
832,7/9/2022,integer pede justo lacinia eget tincidunt eget tempus vel pede morbi porttitor lorem id ligula,139
833,1/25/2023,sed tristique in tempus sit amet sem fusce consequat nulla nisl,178
834,4/12/2022,a libero nam dui proin leo odio porttitor id consequat in consequat ut nulla sed accumsan felis,36
835,5/11/2022,pede malesuada in imperdiet et commodo vulputate justo in,40
